{
  "session_id": "conv-strategy-Expert_Authority_Trust-P008",
  "strategy_id": "strategy-Expert_Authority_Trust",
  "persona_id": "P008",
  "turns": [
    {
      "role": "agent",
      "content": "건강하려고 먹는 영양제, 성분 배합과 제조 시설 인증 마크까지 꼼꼼하게 확인하고 고르시나요? 단순히 유명한 제품을 찾기보다, 내 몸에 직접 들어가는 것인 만큼 어떤 기준으로 영양제를 선택하고 계신지 궁금합니다."
    },
    {
      "role": "persona",
      "content": "유명세보다는 성분 함량과 제 루틴에 얼마나 효율적으로 녹아드는지를 우선으로 봅니다. 지금은 아침에 종합비타민 하나로 끝내고 있는데, 오후가 되면 확실히 피로감이 느껴지긴 해요. \n\n혹시 지금 제안하시려는 제품이 기존 비타민과 성분이 겹치는지, 아니면 오후 시간대 체력 저하를 보완해줄 만한 구체적인 성분이 들어있는지 궁금합니다. 하루 섭취 비용은 얼마 정도인가요? 딱 필요한 만큼만 보완하고 싶어서요."
    },
    {
      "role": "agent",
      "content": "오후의 피로감을 느끼신다면, 기존 비타민이 단순히 '기초'만 채워주고 있을 가능성이 큽니다. 바이탈케어는 한국인에게 필수적인 비타민D와 아연의 면역 조합에, 에너지 대사를 돕는 비타민 B군을 고함량으로 배합해 오후의 무기력함을 잡는 데 최적화되어 있습니다.\n\n가격은 60정(2개월분)에 29,900원으로, 하루 약 500원꼴로 부담 없이 관리하실 수 있습니다. 식약처 GMP 인증 시설에서 안전하게 생산된 제품이라 성분 신뢰도 면에서도 확실하실 거예요. 현재 드시는 제품과 비교해 보시면서, 저희 제품이 고객님의 오후 컨디션을 얼마나 끌어올릴 수 있을지 직접 확인해 보시는 건 어떨까요?"
    },
    {
      "role": "persona",
      "content": "하루 500원이라면 비용 면에서는 크게 부담스럽지 않네요. 다만 제가 지금 먹는 종합비타민에도 비타민 B군이 포함되어 있는데, 이 제품을 추가했을 때 과잉 섭취 문제가 없을지 궁금합니다. \n\n오후 피로감이 문제라면 B군 함량을 높이는 게 맞겠지만, 제가 먹는 제품과 성분이 얼마나 겹치는지 정확히 알아야 루틴에 넣을지 결정할 수 있을 것 같아요. 혹시 기존 비타민과 병용했을 때 겹치는 함량이나, 이 제품만의 차별화된 핵심 성분 2~3가지만 딱 정리해주실 수 있을까요? 지금 루틴에서 뭘 빼고 이걸 넣어야 할지 판단이 서야 해서요."
    },
    {
      "role": "agent",
      "content": "날카로운 질문 감사합니다. 영양제는 '더하기'보다 '균형'이 중요하죠. 말씀하신 대로 비타민 B군은 수용성이라 과잉 섭취 시 배출되지만, 굳이 불필요한 중복을 피하는 것이 현명한 소비입니다.\n\n바이탈케어의 핵심 차별점은 **'오후의 에너지'**에 집중했다는 점입니다. 기존 비타민과 병용하신다면 아래 3가지를 체크해 보세요.\n\n1. **고함량 비타민 B군(활성형):** 일반 종합비타민의 B군은 함량이 낮아 에너지 전환 속도가 더딘 경우가 많습니다. 저희 제품은 에너지 대사를 즉각적으로 돕는 고함량 B군을 담아, 오후 피로를 느끼는 분들께 최적화되어 있습니다.\n2. **면역 핵심 조합(아연+비타민D):** 많은 종합비타민이 놓치기 쉬운 한국인 필수 영양소인 아연과 비타민D를 충분량 배합하여, 면역 기초를 탄탄하게 세웁니다.\n3. **눈 건강(루테인 포함):** 사무직이나 학생이라면 필수적인 루테인이 포함되어 있어, 별도의 눈 영양제를 드실 필요가 없습니다.\n\n만약 기존 제품이 기초 영양을 담당한다면, 바이탈케어는 그 위에 '에너지'와 '면역', '눈 건강'이라는 구체적인 기능을 더하는 셈입니다. 혹시 지금 드시는 제품의 비타민 B군 함량을 알고 계신가요? 알려주시면 중복 여부를 더 정확히 짚어드릴 수 있습니다. \n\n내 몸에 직접 들어가는 건데, 30일 환불 보장 제도를 활용해 리스크 없이 먼저 체감해 보시는 건 어떨까요?"
    },
    {
      "role": "persona",
      "content": "비타민 B군 함량은 제가 먹는 제품 확인해 보니 1일 영양성분 기준치 대비 100% 정도네요. 말씀하신 제품은 '활성형'이라니 흡수율 측면에서는 차이가 있겠군요.\n\n그런데 루테인이 포함되어 있다면, 제가 따로 챙기는 눈 영양제와 성분이 겹칠 것 같습니다. 지금 루틴에서 눈 영양제를 빼고 이걸 넣었을 때, 오후 피로 개선 효과가 기존 영양제보다 확실히 나을지 계산이 좀 필요하네요.\n\n혹시 이 제품, 식후에 바로 먹는 게 좋은가요? 아니면 오후에 처질 때쯤 따로 챙겨 먹는 게 효과적인지, 섭취 타이밍에 따른 체감 차이가 있는지 궁금합니다. 이 부분까지 확인되면 결정하겠습니다."
    }
  ],
  "ended_by": "turn_limit"
}