{
  "session_id": "conv-strategy-strategy_2_roi_risk_reversal-P002",
  "strategy_id": "strategy-strategy_2_roi_risk_reversal",
  "persona_id": "P002",
  "turns": [
    {
      "role": "agent",
      "content": "안녕하세요! 혹시 요즘 피곤하실 때 습관적으로 커피나 에너지 음료를 찾게 되시나요? 매일 챙겨 드시는 음료값으로 하루에 대략 얼마 정도 지출하시는지 궁금합니다. \n\n현명하게 건강을 관리하시는 분들을 위해, 커피 한 잔 값도 안 되는 비용으로 매일의 활력을 챙길 수 있는 '바이탈케어 데일리 멀티비타민'을 소개해 드리고 싶어서요."
    },
    {
      "role": "persona",
      "content": "커피는 하루 두 잔 정도 마시는데, 하루에 8,000원에서 9,000원 정도 나가는 것 같습니다. 그런데 커피는 점심 먹고 나면 딱 30분 지나서 다시 졸리고, 퇴근할 때쯤엔 오히려 카페인 때문에 속만 쓰리고 더 처지는 느낌이라 고민이긴 했거든요.\n\n말씀하신 '바이탈케어'는 하루 섭취 비용이 정확히 얼마인가요? 그리고 이게 커피처럼 잠깐 반짝하게 만드는 게 아니라, 오후 3~4시쯤 회의할 때 집중력이 풀리는 걸 잡아줄 수 있는 건지 궁금합니다. 단순히 비타민 함량만 높은 건지, 아니면 피로 개선에 특화된 성분이 따로 있는 건지도 말씀해 주세요."
    },
    {
      "role": "agent",
      "content": "커피 두 잔이면 하루에 거의 9,000원을 쓰시는군요. 말씀하신 대로 카페인은 일시적인 각성 효과만 줄 뿐, 몸의 근본적인 피로를 해결해주지는 못하죠.\n\n'바이탈케어 데일리 멀티비타민'은 2개월분에 29,900원입니다. 하루로 따지면 약 500원꼴인데, 고객님이 쓰시는 커피값의 1/18 수준으로 훨씬 경제적이죠. 즉, 커피 한 잔 값으로 9일 치의 활력을 챙기시는 셈입니다.\n\n성분 면에서 자신 있게 말씀드리자면, 단순히 비타민만 때려 넣은 제품이 아닙니다. 에너지 대사에 필수적인 '비타민 B군'을 고함량으로 배합해, 오후 3~4시쯤 겪으시는 에너지 저하를 근본적으로 방지합니다. 여기에 면역력을 위한 아연과 비타민D, 눈 건강을 위한 루테인까지 한 알에 담았습니다. 일시적인 카페인 각성이 아니라, 몸 안의 에너지 엔진을 돌리는 원리라 체감하시는 피로감이 확실히 다를 겁니다. \n\n직접 드셔보시고 오후의 집중력이 어떻게 달라지는지 확인해보시는 건 어떨까요? 30일 동안 드셔보시고 아침이 가벼워지는 느낌이 없으시다면, 조건 없이 전액 환불해 드립니다. 고객님께는 전혀 손해가 없는 선택인데, 한 번 체험해보시겠어요?"
    },
    {
      "role": "persona",
      "content": "하루 500원꼴이면 확실히 커피값보다는 부담이 덜하네요. 계산해보니 2개월치면 커피 며칠 안 마시는 셈인데, 사실 커피는 마셔도 오후 3시쯤 되면 머리가 멍해지는 게 문제라 바꿔볼 만한 수치긴 합니다.\n\n궁금한 게 하나 있는데, 비타민 B군 고함량이라고 하셨잖아요. 이게 공복에 먹으면 속이 쓰리다는 제품들도 있던데, 출근해서 바로 먹어도 괜찮을까요? 그리고 카페인처럼 먹자마자 심장이 두근거리는 게 아니라, 서서히 에너지가 유지되는 느낌인 건지 궁금합니다. 오후 회의 때 멍하니 있는 시간이 줄어드는 게 제 제일 큰 목표라서요."
    },
    {
      "role": "agent",
      "content": "비타민 B군은 고함량일 경우 공복에 드시면 울렁거림을 느끼실 수 있는데, '바이탈케어'는 아침 식사 직후에 드시는 것을 권장해 드립니다. 식후에 드시면 흡수율도 높고 속도 훨씬 편안하실 거예요.\n\n또한, 카페인처럼 심장을 뛰게 하는 일시적 자극이 아니라, 체내 에너지 대사를 활성화하는 방식이라 에너지가 훨씬 안정적으로 유지됩니다. 오후 3~4시의 '멍한 상태'는 몸의 에너지가 고갈되었을 때 나타나는 현상인데, 비타민 B군이 에너지 엔진을 꾸준히 돌려주어 그 시간을 훨씬 명료하게 보내실 수 있도록 도와드릴 겁니다. \n\n직접 그 차이를 느껴보시는 게 가장 확실한데, 일단 한 달 정도 꾸준히 챙겨 드셔보시겠어요? 만약 기대하셨던 오후의 집중력 개선이 느껴지지 않는다면 30일 환불 보장 제도를 통해 전액 돌려받으실 수 있으니, 고객님께는 전혀 손해 보실 일이 없는 합리적인 선택이 될 것입니다. 바로 시작해 보시겠습니까?"
    },
    {
      "role": "persona",
      "content": "식후에 바로 먹는 게 루틴이라면 아침에 챙기긴 어렵지 않겠네요. 출근해서 바로 커피부터 내리는 습관 대신 물 한 잔이랑 이거 먼저 먹는 걸로 바꾸면 될 것 같습니다. \n\n심장이 뛰는 느낌이 아니라 대사가 도는 느낌이라는 게 사실 좀 와닿네요. 카페인은 확실히 오후에 속도 쓰리고 퇴근 무렵엔 오히려 더 처지는데, 이게 그 '멍한 시간'을 줄여준다면 업무 효율 면에서 충분히 계산이 서는 투자라고 봅니다. \n\n마침 환불 보장도 된다고 하니, 밑져야 본전이라는 생각으로 한번 시작해 보겠습니다. 주문은 어디서 하면 되나요?"
    }
  ],
  "ended_by": "turn_limit"
}