{
  "session_id": "conv-strategy-EXPERT_AUTHORITY_EMPATHY-P010",
  "strategy_id": "strategy-EXPERT_AUTHORITY_EMPATHY",
  "persona_id": "P010",
  "turns": [
    {
      "role": "agent",
      "content": "퇴근 무렵인 오후 6시, 모니터 속 텍스트가 조금 흐릿하게 느껴지고 목과 어깨가 유독 무겁게 느껴지시나요? 눈의 황반 색소 밀도를 유지해 주는 루테인과 에너지 대사를 돕는 비타민 B군은 현대인이라면 꼭 분리해서 생각해야 할 필수 영양 성분입니다.\n\n저희 '바이탈케어 데일리 멀티비타민'은 루테인 20mg으로 눈 건강을 챙기는 동시에, 아연 8.5mg으로 정상적인 세포 분열과 면역 기능을 지원합니다. 국내 GMP 인증 공장에서 엄격한 온습도 관리와 교차 오염 방지 시스템을 거쳐 생산되기에 더욱 안심하고 섭취하실 수 있는데요, 평소 눈의 피로감이 잦으신 편인가요?"
    },
    {
      "role": "persona",
      "content": "말씀하신 대로 오후 되면 눈이 침침하고 어깨가 무거운 건 사실인데, 영양제는 이것저것 챙기기 시작하면 끝이 없더라고요. 지금 종합비타민 하나 먹고 있는데, 이거 새로 바꾸면 하루에 얼마꼴로 드는 건가요? 한 통에 며칠 분량인지, 그리고 지금 먹는 거랑 비교해서 뭐가 더 실속 있는지 딱 정리해서 알려주세요. 아침에 밥 먹고 바로 한 번만 먹으면 되는지도 궁금하고요."
    },
    {
      "role": "agent",
      "content": "바쁘신 와중에 이것저것 챙기기 번거로우신 마음 충분히 이해합니다. 바이탈케어 데일리 멀티비타민은 한 통에 60정이 들어있어 하루 한 알씩 총 2개월(60일)간 섭취 가능하며, 가격은 29,900원으로 하루 약 500원꼴입니다.\n\n기존에 드시던 제품과 비교하자면, 저희 제품은 '눈 건강'을 위한 루테인 20mg을 핵심 성분으로 포함하여 별도로 루테인을 챙기지 않아도 된다는 점이 실속 있는 포인트입니다. 또한, 아연 8.5mg과 비타민 D를 통해 면역 기능과 칼슘 흡수를 체계적으로 돕도록 설계되었습니다. 말씀하신 대로 아침 식사 직후에 하루 딱 한 알만 드시면 되니, 번거로움은 줄이면서 필요한 성분은 놓치지 않으실 겁니다. 혹시 현재 드시는 제품에 루테인도 함께 포함되어 있나요?"
    },
    {
      "role": "persona",
      "content": "아니요, 지금 먹는 종합비타민에는 루테인은 따로 없어요. 그냥 비타민 몇 가지 섞인 기본 제품이라, 따로 루테인을 사야 하나 고민하던 참이었거든요.\n\n하루 500원이면 커피 한 잔 값보다 훨씬 낫네요. 아침에 밥 먹고 바로 한 알만 먹으면 된다는 점이 제일 마음에 들어요. 지금 먹는 비타민은 다 먹어가는데, 이거 한 통 사면 딱 두 달 치라고 하셨죠? 그럼 지금 먹는 걸 굳이 따로 안 사도 루테인까지 해결되는 거네요. 성분 이름이 복잡해도 결국 눈 건강이랑 면역 챙기는 거면 다른 거랑 섞어서 먹는 것보다 이게 더 효율적이겠어요. 이거 배송은 얼마나 걸려요?"
    },
    {
      "role": "agent",
      "content": "네, 맞습니다. 루테인을 따로 구매하지 않으셔도 되니 비용 면에서도, 챙겨 드시는 번거로움 면에서도 훨씬 효율적인 선택이 되실 겁니다. 바이탈케어 데일리 멀티비타민은 한 통에 60정, 딱 2개월 분량이니 지금 드시는 제품을 다 비우고 바로 넘어가시면 흐름 끊길 걱정도 없으실 거예요.\n\n배송은 평일 기준으로 오후 2시 이전 주문 건은 당일 출고를 원칙으로 하고 있어, 보통 주문하신 다음 날이나 늦어도 2일 이내에는 수령하실 수 있습니다. 만약 직접 섭취해 보시고 몸에 잘 맞지 않으시거나 만족스럽지 않으시다면, 30일 이내에는 언제든 환불을 보장해 드리고 있으니 너무 걱정 마시고 편하게 시작해 보셨으면 합니다. 바로 주문 도와드릴까요?"
    },
    {
      "role": "persona",
      "content": "그럼 내일 오후 2시 전까지만 주문하면 되겠네요. 환불 보장까지 해준다니 일단 마음은 놓이는데, 배송받으면 아침 식사 마치고 바로 한 알씩 꼬박꼬박 챙겨 먹어볼게요. \n\n이게 루테인 따로 사는 것보다 훨씬 경제적이고 간편한 것 같아서 마음에 드네요. 남편이랑 같이 먹으면 한 달이면 다 먹겠는데, 처음이니까 우선 한 통만 먼저 주문해봐야겠어요. 지금 바로 결제창 알려주세요."
    }
  ],
  "ended_by": "turn_limit"
}