{
  "session_id": "conv-strategy-1-P006",
  "strategy_id": "strategy-1",
  "persona_id": "P006",
  "turns": [
    {
      "role": "agent",
      "content": "[LLM ERROR] Gemini HTTP 429: {\n  \"error\": {\n    \"code\": 429,\n    \"message\": \"You exceeded your current quota, please check your plan and billing details. For more information on this error, head to: https://ai.google.dev/gemini-api/docs/rate-limits. To monitor your current usage, head to: https://ai.dev/rate-limit. \\n* Quota exceeded for metric: generativelanguage.googleapis.com/generate_content_free_tier_requests, limit: 5, model: gemini-2.5-flash\\nPlease retry in 40.319149521s.\",\n    \"status\": \"RESOURCE_EXHAUSTED\",\n    \"d"
    },
    {
      "role": "persona",
      "content": "[LLM ERROR] Gemini HTTP 429: {\n  \"error\": {\n    \"code\": 429,\n    \"message\": \"You exceeded your current quota, please check your plan and billing details. For more information on this error, head to: https://ai.google.dev/gemini-api/docs/rate-limits. To monitor your current usage, head to: https://ai.dev/rate-limit. \\n* Quota exceeded for metric: generativelanguage.googleapis.com/generate_content_free_tier_requests, limit: 5, model: gemini-2.5-flash\\nPlease retry in 39.900680716s.\",\n    \"status\": \"RESOURCE_EXHAUSTED\",\n    \"d"
    },
    {
      "role": "agent",
      "content": "[LLM ERROR] Gemini HTTP 429: {\n  \"error\": {\n    \"code\": 429,\n    \"message\": \"You exceeded your current quota, please check your plan and billing details. For more information on this error, head to: https://ai.google.dev/gemini-api/docs/rate-limits. To monitor your current usage, head to: https://ai.dev/rate-limit. \\n* Quota exceeded for metric: generativelanguage.googleapis.com/generate_content_free_tier_requests, limit: 5, model: gemini-2.5-flash\\nPlease retry in 39.463850558s.\",\n    \"status\": \"RESOURCE_EXHAUSTED\",\n    \"d"
    },
    {
      "role": "persona",
      "content": "[LLM ERROR] Gemini HTTP 429: {\n  \"error\": {\n    \"code\": 429,\n    \"message\": \"You exceeded your current quota, please check your plan and billing details. For more information on this error, head to: https://ai.google.dev/gemini-api/docs/rate-limits. To monitor your current usage, head to: https://ai.dev/rate-limit. \\n* Quota exceeded for metric: generativelanguage.googleapis.com/generate_content_free_tier_requests, limit: 5, model: gemini-2.5-flash\\nPlease retry in 39.064717817s.\",\n    \"status\": \"RESOURCE_EXHAUSTED\",\n    \"d"
    },
    {
      "role": "agent",
      "content": "[LLM ERROR] Gemini HTTP 429: {\n  \"error\": {\n    \"code\": 429,\n    \"message\": \"You exceeded your current quota, please check your plan and billing details. For more information on this error, head to: https://ai.google.dev/gemini-api/docs/rate-limits. To monitor your current usage, head to: https://ai.dev/rate-limit. \\n* Quota exceeded for metric: generativelanguage.googleapis.com/generate_content_free_tier_requests, limit: 5, model: gemini-2.5-flash\\nPlease retry in 38.64586298s.\",\n    \"status\": \"RESOURCE_EXHAUSTED\",\n    \"de"
    },
    {
      "role": "persona",
      "content": "[LLM ERROR] Gemini HTTP 429: {\n  \"error\": {\n    \"code\": 429,\n    \"message\": \"You exceeded your current quota, please check your plan and billing details. For more information on this error, head to: https://ai.google.dev/gemini-api/docs/rate-limits. To monitor your current usage, head to: https://ai.dev/rate-limit. \\n* Quota exceeded for metric: generativelanguage.googleapis.com/generate_content_free_tier_requests, limit: 5, model: gemini-2.5-flash\\nPlease retry in 38.24606923s.\",\n    \"status\": \"RESOURCE_EXHAUSTED\",\n    \"de"
    }
  ],
  "ended_by": "turn_limit"
}