{
  "session_id": "conv-strategy-ROI_LOGICAL_CONTRAST-P001",
  "strategy_id": "strategy-ROI_LOGICAL_CONTRAST",
  "persona_id": "P001",
  "turns": [
    {
      "role": "agent",
      "content": "오후 3시만 되면 습관처럼 4,500원짜리 커피부터 찾고 계시진 않나요? 매일 마시는 커피 대신, 하루 500원으로 피로를 잠시 미루는 '에너지 가불'이 아닌, 체내에서 직접 에너지를 생성하는 근본적인 습관을 시작해보시는 건 어떨까요?\n\n커피는 카페인으로 뇌의 아데노신 수용체를 차단해 피로를 느끼지 못하게 할 뿐이지만, 저희 '바이탈케어 데일리 멀티비타민'의 비타민 B군은 탄수화물과 단백질을 실제 에너지원인 ATP로 전환하는 대사 과정을 돕습니다. 한 달 기준 커피값은 약 135,000원이지만, 이 제품은 15,000원 수준으로 1/9밖에 되지 않아 경제적이기까지 합니다. 혹시 평소 오후만 되면 급격히 체력이 떨어지는 편이신가요?"
    },
    {
      "role": "persona",
      "content": "커피값 계산하신 건 좀 솔깃하네요. 사실 저도 야간 알바 끝나고 학교 가면 무조건 고카페인 음료부터 찾거든요. 근데 이게 마실 땐 괜찮아도 나중에 훅 꺼지는 느낌이라, 말씀하신 '에너지 대사'라는 게 정확히 뭔지 궁금합니다.\n\n제가 궁금한 건 이거예요. 지금 제가 편의점에서 사 먹는 비타민 음료는 마시면 바로 정신이 좀 드는 느낌인데, 이건 먹으면 체감이 언제부터 오나요? 그리고 하루 500원 꼴이라고 하셨는데, 한 통 사면 며칠 분량이고 챙겨 먹는 법은 어떻게 되죠? 복잡하면 안 먹게 돼서요."
    },
    {
      "role": "agent",
      "content": "날카로운 질문 감사합니다. 우선 에너지 대사부터 설명해 드릴게요. 편의점 음료는 카페인과 당분으로 뇌를 일시적으로 각성시키는 '가불' 방식이라면, 저희 비타민 B군은 체내에서 영양소를 실제 에너지(ATP)로 바꾸는 공장의 '연료' 역할을 합니다. 즉, 에너지를 직접 생성하는 과정이라 커피처럼 툭 끊기는 느낌 대신, 몸이 무겁지 않고 꾸준히 유지되는 체감을 경험하시게 될 겁니다.\n\n한 통은 총 60정으로 딱 2개월분(하루 500원꼴)이며, 가격은 29,900원입니다. 챙겨 먹는 법도 매우 간단합니다. 아침 식사 후에 딱 한 알만 드시면 끝입니다. 복잡한 과정 없이 하루 한 번으로 충분하니 번거로움은 걱정하지 않으셔도 됩니다. 혹시 이미 다른 영양제를 챙겨 드시고 계신 게 있나요? 성분 중복 여부를 체크해 드리면 더 안심하고 시작하실 수 있을 것 같습니다."
    },
    {
      "role": "persona",
      "content": "아, 2개월에 3만 원이면 하루 500원 계산 딱 맞네요. 일단 가격은 납득 가능합니다. 지금 먹는 건 그냥 비타민 음료랑 가끔 편의점에서 1+1 하는 저가 종합비타민인데, 솔직히 효과는 잘 모르겠고 그냥 안 먹으면 불안해서 먹거든요.\n\n근데 이거 먹으면 커피처럼 먹자마자 '번쩍' 하는 느낌은 없는 거죠? 야간 알바 끝나고 바로 수업 들어가야 할 때는 당장 정신 차리는 게 급해서요. 그리고 아침 식사 후에 먹으라고 하셨는데, 제가 알바 끝나고 바로 자는 날이 많아서요. 일어나서 밥 먹고 먹으면 되는 건가요? 아니면 공복에 먹어도 속 쓰림 같은 건 없는지 궁금하네요. 지금 먹는 건 빈속에 먹으면 속이 좀 울렁거려서요."
    },
    {
      "role": "agent",
      "content": "맞습니다. 카페인처럼 뇌를 즉각적으로 강제 각성시키는 '번쩍'하는 느낌은 없지만, 대신 오후 내내 겪으시는 '카페인 훅 꺼짐' 현상 없이 에너지가 일정하게 유지되는 것을 느끼실 겁니다. \n\n복용법의 경우, 일어나셔서 식사를 가볍게 하신 뒤 한 알 드시는 것을 가장 권장합니다. 비타민 B군 고함량 제품은 공복에 드실 경우 사람에 따라 울렁거림을 느끼실 수 있는데, 식후 복용은 흡수율을 높이고 속 쓰림을 방지하는 가장 안전한 방법입니다.\n\n참고로, 지금 드시는 저가형 종합비타민은 성분 함량이 낮아 체감이 적었을 가능성이 큽니다. 저희 제품은 국내 GMP 인증 시설에서 제조되었고, 30일 동안 드셔보신 뒤 효과를 체감하지 못하시면 100% 환불을 보장해 드리고 있습니다. 혹시 지금 드시는 종합비타민 뒷면의 성분표를 보실 수 있다면, 특히 '아연' 함량이 얼마나 되는지 확인해 봐 드릴까요? 다른 영양제와 중복으로 과다 섭취되지 않도록 제가 꼼꼼히 봐 드리겠습니다."
    },
    {
      "role": "persona",
      "content": "환불 보장까지 걸어두시는 거 보니까 성분 함량에는 자신 있으신가 보네요. 지금 먹는 저가형 비타민은 확인해 봤는데 아연이 5mg 정도 들어있거든요. 이거랑 같이 먹어도 문제없는 수준인가요?\n\n그리고 야간 알바 하고 낮에 수업 듣는 날에는 사실 식사를 제대로 챙겨 먹기가 힘들거든요. 가볍게라도 뭘 먹고 먹어야 한다는 게 조금 걸리는데, 혹시 진짜 밥을 제대로 챙겨 먹어야 하는지, 아니면 그냥 에너지바 하나 정도 먹고 먹어도 속 쓰림 방지가 될지 궁금합니다. 이 부분만 해결되면 한번 시도해 볼 만할 것 같아서요."
    }
  ],
  "ended_by": "turn_limit"
}