{
  "session_id": "conv-strategy-strategy_1_ROI_simplification-P001",
  "strategy_id": "strategy-strategy_1_ROI_simplification",
  "persona_id": "P001",
  "turns": [
    {
      "role": "agent",
      "content": "고객님, 안녕하세요! 혹시 매달 건강을 위해 챙겨 드시는 영양제나, 습관처럼 마시는 커피값으로 지출하시는 금액이 대략 얼마 정도인지 계산해 보신 적 있으신가요? \n\n사실 하루에 커피 한 잔만 마셔도 한 달이면 10만 원이 훌쩍 넘는데, 저희 '바이탈케어 데일리 멀티비타민'은 하루 딱 500원으로 만성 피로를 잡는 고함량 비타민B군부터 면역력, 눈 건강까지 한 번에 챙기실 수 있거든요. 여러 영양제를 번거롭게 따로 사실 필요 없이 아침 식후 1정이면 충분합니다."
    },
    {
      "role": "persona",
      "content": "하루 500원이면 한 달에 15,000원 정도겠네요. 지금 편의점에서 야간 알바 끝나고 마시는 비타민 음료가 한 병에 1,500원꼴이니까, 가격만 보면 확실히 저렴하긴 하네요. \n\n근데 제가 궁금한 건 이게 커피나 비타민 음료처럼 그때만 반짝하고 끝나는 건지, 아니면 야간 알바 끝나고 아침 수업 들을 때 체감되는 지속력이 얼마나 다른지예요. 편의점 음료는 당분 때문에 잠깐 정신이 드는 것 같긴 한데, 이게 그런 거랑 비교해서 성분적으로 뭐가 다른 건가요? 괜히 샀다가 효과도 없이 챙겨 먹기만 번거로워질까 봐요."
    },
    {
      "role": "agent",
      "content": "날카로운 질문이시네요! 편의점 비타민 음료는 당분과 카페인으로 일시적인 각성 효과를 내는 것이라 금방 다시 피로해지지만, 바이탈케어는 다릅니다. 우리 몸의 에너지 대사를 근본적으로 돕는 '비타민 B군'이 고함량으로 설계되어 있어, 일시적인 반짝 효과가 아니라 체내 에너지 생성을 지속적으로 돕는 방식입니다.\n\n특히 알바와 학업을 병행하시느라 체력 소모가 크실 텐데, 인위적인 당분 대신 면역력과 눈 건강 성분까지 채워주니 훨씬 안정적인 컨디션을 유지하실 수 있을 거예요. 혹시라도 직접 드셔보시고 체감 효과가 기대에 미치지 못한다면 30일 이내 100% 환불 보장 제도가 있으니, 밑져야 본전이라는 생각으로 한 번 경험해 보시는 건 어떨까요?"
    },
    {
      "role": "persona",
      "content": "환불 보장까지 걸려 있으면 일단 리스크는 없겠네요. 그런데 궁금한 게 하나 더 있는데, 이게 고함량이라고 하셨잖아요. 제가 공복에 예민한 편인데, 아침에 수업 가기 전에 빈속에 먹어도 속 쓰림 같은 건 없을까요? 편의점 음료는 당이 많아서 공복에 마시면 오히려 속이 좀 울렁거릴 때가 있거든요.\n\n그리고 이게 한 통 사면 딱 며칠 분량인가요? 매번 주문하는 것도 일이라, 한 번 살 때 몇 달치씩 쟁여두는 게 편한데 계산기 좀 두드려보게 정확한 용량이랑 구성 알려주세요."
    },
    {
      "role": "agent",
      "content": "좋은 질문입니다! 우선 바이탈케어는 공복 시 속 쓰림을 유발할 수 있는 성분들을 최소화하고 흡수율을 높인 제품이라, 가급적 아침 식후에 드시는 것을 권장합니다. 혹시 아침을 거르신다면 우유 한 잔이나 가벼운 간식과 함께 드시면 속 불편함 없이 편안하게 섭취하실 수 있습니다.\n\n용량은 한 통에 총 60정이 들어있어, 하루 1정씩 드시면 딱 2개월(60일) 분량입니다. 가격은 한 통에 29,900원으로, 하루 500원꼴이니 계산해 보시면 정말 경제적이죠. 2개월마다 한 번씩 챙기시면 되니 번거로움도 적으실 겁니다. 이번 기회에 2개월 동안 꾸준히 몸의 변화를 직접 체감해 보시는 건 어떨까요?"
    },
    {
      "role": "persona",
      "content": "60정에 29,900원이면, 말씀하신 대로 하루 500원꼴 딱 맞네요. 편의점 음료는 하루 한 병씩 마시면 한 달에 4만 5천 원 정도 깨지는데, 그거랑 비교하면 비용은 확실히 3분의 1 수준으로 줄어드는 셈이네요.\n\n다만, 저는 아침을 챙겨 먹기가 힘들어서요. 아까 식후 섭취를 권장하셨는데, 혹시 속 쓰림 방지를 위해 정제 사이즈가 작게 나온 편인가요? 아니면 공복에 먹었을 때 구역감이나 속 쓰림을 겪은 다른 사용자들 피드백은 없었는지 궁금해요. \n\n그리고 2개월 분량이면 꽤 긴데, 혹시 중간에 먹다가 습관 안 잡혀서 남기게 되면 아까우니까요. 첫 구매 때 할인 혜택 같은 건 따로 없는지, 아니면 60일치 한 통만 사서 테스트해 보는 게 제일 나을지 고민되네요. 계산기 두드려보니 가성비는 확실히 괜찮아 보이는데, 섭취 편의성이랑 첫 구매 혜택 정보 좀 더 주시겠어요?"
    }
  ],
  "ended_by": "turn_limit"
}