{
  "session_id": "conv-strategy-strategy_3_authority_loss_aversion-P006",
  "strategy_id": "strategy-strategy_3_authority_loss_aversion",
  "persona_id": "P006",
  "turns": [
    {
      "role": "agent",
      "content": "고객님, 영양제 고르실 때 단순히 가격만 보시나요, 아니면 성분 함량과 제조 시설 인증 마크(GMP)까지 꼼꼼히 확인하시나요? \n\n내 몸에 직접 들어가는 만큼 어디서, 어떻게 만들었는지가 가장 중요한데, 제가 추천드리는 '바이탈케어 데일리 멀티비타민'은 식약처가 인정한 엄격한 국내 GMP 인증 공장에서 생산되어 안심하고 드실 수 있습니다. 피로 회복을 위한 고함량 비타민 B군부터 면역을 위한 아연·비타민D, 현대인의 눈 건강을 위한 루테인까지 단 1정으로 3중 케어가 가능한 제품입니다."
    },
    {
      "role": "persona",
      "content": "제조 시설 인증은 당연한 기본값이라 생각합니다. 제가 궁금한 건 그 3중 케어가 하루에 드는 비용과, 기존에 제가 먹던 일반 종합비타민 대비 실질적인 함량 차이입니다.\n\n비타민 B군이 고함량이라고 하셨는데, 구체적으로 몇 mg이 들어있는지, 그리고 이걸 챙겼을 때 오후 3시쯤 찾아오는 업무 집중력 저하를 얼마나 방어할 수 있을지 숫자로 설명해주시겠습니까? 1일 섭취 비용과 함께 정리해서 말씀 부탁드립니다."
    },
    {
      "role": "agent",
      "content": "날카로운 질문 감사합니다. 역시 건강을 위해 성분을 꼼꼼히 따져보시는군요. \n\n'바이탈케어 데일리 멀티비타민'은 60정(2개월분)에 29,900원으로, **하루 딱 500원**으로 건강을 관리하실 수 있습니다. 비타민 B군의 경우, 에너지 대사에 핵심적인 비타민 B1, B2, B6가 **일일 영양성분 기준치 대비 1,000% 이상 고함량**으로 배합되어 있습니다. 단순히 권장량을 채우는 수준을 넘어, 체내 에너지 회전율을 빠르게 높여주기 때문에 오후 3시경 찾아오는 만성 피로와 집중력 저하를 방어하는 데 훨씬 효과적입니다.\n\n일반적인 종합비타민이 단순히 '결핍 예방'에 초점을 맞춘다면, 이 제품은 활력을 유지하는 '에너지 부스팅'에 특화된 함량입니다. 매일 500원이면 커피 한 잔보다 훨씬 저렴한 비용으로 하루 종일 쌩쌩한 컨디션을 유지할 수 있죠. 나중에 체력이 바닥나서 병원이나 보약에 수십만 원을 쓰시는 것보다, 지금 하루 500원으로 탄탄하게 예방하는 것이 훨씬 경제적인 선택 아닐까요? 30일간 드셔보시고 만족하지 못하시면 100% 환불도 보장해 드리고 있으니, 우선 한 번 경험해 보시는 건 어떨까요?"
    },
    {
      "role": "persona",
      "content": "하루 500원이라는 비용은 납득 가능한 수준이네요. 제가 지금 먹는 제품은 비타민 B군이 기준치 대비 100~200% 수준인데, 1,000%라는 수치는 확실히 에너지 대사 체감에 차이가 있을 것 같습니다.\n\n다만, 함량이 높다고 무조건 좋은 건 아니지 않습니까. B군 같은 수용성 비타민은 과잉 섭취 시 배출되는 양도 많을 텐데, 이 정도 고함량이 제 몸에 흡수되어 오후 업무 효율을 실질적으로 높여준다는 근거가 있을까요? 단순히 '부스팅'이라는 모호한 표현 말고, 혹시 이 제품의 비타민 B군 흡수율을 높이기 위한 공법이나 배합상의 특징이 따로 있는지 궁금합니다. 이 부분까지 설명이 된다면 바로 결정을 내릴 수 있을 것 같습니다."
    },
    {
      "role": "agent",
      "content": "매우 날카롭고 핵심을 찌르는 질문입니다. 맞습니다, 단순히 함량만 높이는 건 의미가 없죠. \n\n우리 제품은 수용성 비타민 B군의 체내 흡수율을 극대화하기 위해 **'활성형 비타민 배합'**과 **'시너지 설계'**를 채택했습니다. 일반적인 비타민 B군은 섭취 후 체내에서 대사 과정을 거쳐야 활성화되지만, 우리 제품은 이미 활성형에 가까운 형태로 배합하여 생체 이용률을 높였습니다. 또한, 비타민 B군 단독이 아니라 에너지 대사 조효소인 마그네슘과 미네랄을 최적의 비율로 함께 설계하여, 섭취한 영양소가 단순히 배출되지 않고 세포 내 에너지 생성 사이클(TCA 회로)을 원활하게 돌리도록 돕습니다.\n\n오후 3시의 피로감은 결국 에너지 대사 효율이 떨어지기 때문인데, 이 제품은 그 회전율을 강제로 끌어올리는 것이 아니라 효율적으로 돌아가게끔 환경을 조성하는 것입니다. 30일 환불 보장 제도를 운영하는 이유도 제품의 배합 기술과 체감도에 대한 자신감 때문입니다. 오늘부터 하루 500원으로 오후의 집중력을 확보해 보시는 건 어떨까요? 바로 결제를 도와드릴까요?"
    },
    {
      "role": "persona",
      "content": "활성형 비타민 배합과 에너지 대사 조효소인 마그네슘을 함께 설계했다는 부분에서 납득이 되네요. 단순히 함량만 늘린 게 아니라 생체 이용률을 고려했다는 점이 제가 찾던 설명입니다.\n\n결정했습니다. 2개월분 구매하겠습니다. 오후 업무 효율을 확인해보고, 말씀하신 대로 체감 차이가 있다면 계속 정기적으로 챙길 생각입니다. 결제 절차 안내해주시죠."
    }
  ],
  "ended_by": "turn_limit"
}