{
  "session_id": "conv-strategy-EXPERT_AUTHORITY-P002",
  "strategy_id": "strategy-EXPERT_AUTHORITY",
  "persona_id": "P002",
  "turns": [
    {
      "role": "agent",
      "content": "안녕하세요! 혹시 건강기능식품을 고르실 때 성분표와 함량을 꼼꼼히 확인하시는 편인가요? \n\n바쁜 현대인들에게 가장 부족해지기 쉬운 피로 개선(비타민 B군), 면역력(아연+비타민D), 그리고 눈 건강(루테인)까지, 이 3대 핵심 성분만을 식약처 기준에 맞춰 최적으로 배합한 '바이탈케어 데일리 멀티비타민'을 소개해 드립니다. 국내 GMP 인증 시설에서 엄격하게 생산되어 신뢰할 수 있는 제품인데, 평소 건강 관리는 어떻게 하고 계셨나요?"
    },
    {
      "role": "persona",
      "content": "건강 관리는 딱히 루틴이라 할 건 없고, 아침에 출근하자마자 믹스커피 한 잔 마시고 오후 3시쯤 되면 또 아이스 아메리카노로 버티는 게 전부입니다. 그런데 이게 오후 4시 넘어가면 카페인 효과가 떨어지면서 머리가 멍해지고, 퇴근 직전에 보고서 쓸 때 집중력이 확 떨어지는 게 문제거든요.\n\n소개해주신 제품이 '비타민 B군' 위주라고 하셨는데, 제가 지금 커피로 억지로 끌어올리는 텐션을 이 제품으로 대체했을 때 오후 시간대 집중력이 얼마나 유지될지가 관건입니다. 이거 하루 섭취 비용은 어느 정도 되나요? 그리고 커피처럼 일시적인 각성 효과가 아니라, 실제로 퇴근 전까지 '덜 퍼지는' 느낌을 받으려면 어느 정도 기간을 꾸준히 먹어야 체감이 올까요?"
    },
    {
      "role": "agent",
      "content": "오후 3시의 카페인 의존은 많은 직장인분이 겪는 '에너지 고갈'의 전형적인 패턴입니다. 카페인은 에너지를 만드는 게 아니라 체내 저장된 에너지를 앞당겨 쓰는 방식이라 뒤에 오는 피로감이 더 클 수밖에 없죠. 반면, 저희 '바이탈케어 데일리 멀티비타민'의 비타민 B군은 체내 에너지 대사를 직접적으로 활성화해 근본적인 활력을 돕습니다.\n\n가격은 60정(2개월분)에 29,900원으로, 하루 약 500원꼴이라 커피 한 잔보다 훨씬 경제적입니다. 보통 1주일 정도 꾸준히 아침 식후에 챙겨 드시면 오후 시간대의 '멍한 느낌'이 덜해지는 것을 체감하시기 시작할 겁니다. 국내 GMP 인증 시설에서 검증된 성분으로 설계했으니, 카페인으로 억지로 텐션을 올리는 대신 몸 안의 엔진을 제대로 돌려보시는 건 어떨까요? 30일 환불 보장 제도도 운영 중이라 직접 경험해 보시고 결정하셔도 좋습니다."
    },
    {
      "role": "persona",
      "content": "하루 500원꼴이면 확실히 커피 한 잔 값보다 부담은 적네요. 지금처럼 커피 두 잔 마시는 비용이랑 비교하면 오히려 남는 장사긴 한데, 중요한 건 역시 체감이니까요.\n\n말씀하신 대로 카페인은 오후 4시만 넘어가면 심장이 두근거리는 거랑 별개로 뇌가 멍해지는 느낌이 강하거든요. 만약 아침 식후에 먹고 1주일 뒤부터 오후 3시 이후에 '아직은 좀 더 집중할 수 있겠다'는 느낌이 든다면 꽤 괜찮은 투자가 될 것 같습니다. 30일 환불 보장이라고 하셨는데, 이거 복용법은 그냥 아침에 한 알 먹으면 끝인가요? 아니면 오후에 한 번 더 챙겨 먹어야 하는 방식인가요? 번거로우면 또 안 먹게 돼서요."
    },
    {
      "role": "agent",
      "content": "맞습니다. 바쁜 일상에서 복용법이 번거로우면 결국 꾸준히 챙기기 어렵죠. '바이탈케어 데일리 멀티비타민'은 하루 딱 한 알, 아침 식후에 드시는 것으로 설계되었습니다. \n\n고함량 비타민 B군이 아침부터 체내 에너지 대사를 원활하게 돌려주기 때문에, 오후 시간대까지 활력이 유지되도록 돕는 방식입니다. 여러 번 나눠 드실 필요 없이 아침에 물과 함께 한 알만 챙기시면 되니 아주 간편하실 거예요. 카페인처럼 일시적인 각성이 아니라 신체 기능을 정상화하는 원리라, 꾸준히 드실수록 오후의 피로감이 줄어드는 체감을 더 확실히 느끼실 수 있을 겁니다. 바로 시작해보시겠어요?"
    },
    {
      "role": "persona",
      "content": "하루 한 알이면 번거롭지는 않겠네요. 아침에 챙겨 먹고 출근해서 오후 4시쯤 업무 밀도 유지되는 것만 확인되면 확실히 커피보다는 나을 것 같습니다. \n\n카페인으로 심장만 두근거리고 정작 머리는 멍해지는 그 상태가 제일 비효율적이거든요. 만약 주문해서 먹어보고 1주일 정도 지났는데도 오후에 퍼지는 게 똑같으면 환불 보장 제도 바로 이용할 테니까, 일단 한 통만 먼저 써보겠습니다. 구매 링크나 결제 정보 주시죠."
    }
  ],
  "ended_by": "turn_limit"
}