{
  "session_id": "conv-strategy-strategy_2_empathy_social_proof-P003",
  "strategy_id": "strategy-strategy_2_empathy_social_proof",
  "persona_id": "P003",
  "turns": [
    {
      "role": "agent",
      "content": "안녕하세요! 요즘 아침에 알람 소리 들을 때마다 한 번에 일어나기 참 힘드시죠? 날이 갈수록 몸이 천근만근 무겁고 피로가 계속 누적되는 느낌이라 저도 참 고민이 많았거든요.\n\n혹시 지금처럼 바쁜 일상 속에서 따로 건강 챙기기가 쉽지 않으신 상황인가요? 저와 비슷한 고민을 하시는 분들이 요즘 '바이탈케어'를 많이 찾으시길래, 고객님은 아침 컨디션이 어떠신지 궁금해서 먼저 말을 걸어봤어요."
    },
    {
      "role": "persona",
      "content": "네, 아침마다 전쟁이죠. 아이들 깨우고 밥 먹여서 학교 보내고 나면, 저는 이미 출근하기도 전에 기운이 다 빠져 있어요. 지금 비타민이랑 유산균, 오메가3까지 따로 챙겨두긴 했는데, 정신없다 보니 절반은 까먹고 유통기한 지나서 버리는 게 일상이에요.\n\n'바이탈케어'라고 하셨는데, 이게 지금 제가 따로 챙기는 것들을 다 대신할 수 있는 건가요? 아니면 그냥 또 다른 영양제 하나가 추가되는 건지 궁금하네요. 하루에 몇 번이나 먹어야 하고, 실제 비용은 어느 정도 되는지 핵심만 딱 짚어서 말씀해 주시겠어요?"
    },
    {
      "role": "agent",
      "content": "아이들 등교시키느라 아침부터 정말 고생이 많으시네요. 챙겨야 할 영양제가 너무 많아도 오히려 짐이 되죠. 바이탈케어는 그런 번거로움을 덜어드리기 위해 **'딱 하루 한 알'**로 피로 회복에 필수적인 고함량 비타민 B군과 면역을 위한 아연, 비타민 D, 그리고 눈 건강을 위한 루테인까지 한 번에 담았습니다. \n\n기존에 드시던 것 중 피로 관리와 기초 건강이 목적이셨다면, 아침 식후에 이거 한 알만 챙기시는 걸로 훨씬 간편해지실 거예요. 가격은 60정(2개월분)에 29,900원이라 하루 약 500원꼴인데, 여러 개 챙기느라 스트레스받고 유통기한 지나 버리는 비용을 생각하면 훨씬 경제적이죠. 혹시 드셔보시고 몸에 안 맞으시거나 효과를 못 느끼시면 30일 이내에 환불도 보장해 드리고 있으니, 부담 없이 한번 바꿔보시는 건 어떨까요?"
    },
    {
      "role": "persona",
      "content": "하루 500원이면 지금 먹던 것들 낱개로 사는 비용이랑 비교해도 확실히 낫긴 하네요. 무엇보다 아침에 물 한 컵 마시면서 딱 한 알만 삼키면 된다는 게 제일 끌립니다. 지금은 영양제 통만 세 개라 꺼내다 보면 꼭 하나는 빼먹거든요.\n\n그런데 '고함량'이라고 하셨는데, 아침에 빈속은 아니더라도 출근해서 커피 한 잔 마시고 나서 먹어도 속 쓰림 같은 건 없을까요? 제가 위가 좀 예민한 편이라서요. 그리고 이거 하나로 오메가3까지 대체가 되는 건지, 아니면 오메가3는 따로 챙겨야 하는 건지 확인해 주세요. 그 부분만 괜찮으면 지금 루틴에서 바로 갈아탈 생각입니다."
    },
    {
      "role": "agent",
      "content": "위가 예민하신 편이라 걱정되시죠? 바이탈케어는 국내 GMP 인증 시설에서 엄격하게 관리되어 속 쓰림을 최소화하도록 설계되었지만, 혹시 모르니 아침 식사 직후에 드시는 것을 가장 권장드려요. 빈속보다는 훨씬 편안하실 거예요.\n\n그리고 오메가3에 대해 궁금해하셨는데, 아쉽게도 바이탈케어에는 오메가3 성분은 포함되어 있지 않습니다. 다만, 피로회복과 면역, 눈 건강이라는 '데일리 필수 케어'에는 최적화되어 있어 지금처럼 영양제 통을 여러 개 꺼내느라 스트레스받으실 필요 없이, 이 제품 하나로 기초 루틴을 훨씬 가볍고 탄탄하게 만드실 수 있을 거예요. 일단 이것부터 한 알로 시작해 보시고, 나중에 오메가3만 따로 추가하시는 식으로 하시면 훨씬 관리하기 편하실 겁니다. 지금 바로 시작해 보시겠어요?"
    },
    {
      "role": "persona",
      "content": "오메가3까지는 안 들어가는군요. 사실 지금도 오메가3는 챙기다가 속이 좀 불편해서 자주 건너뛰던 참이었거든요. 차라리 기초 컨디션 관리 위주로 확실하게 한 알만 먹는 게 낫겠다 싶네요.\n\n결국 영양제는 눈에 보여야 먹는 건데, 통 하나로 줄어들면 아침에 아이들 보낼 때 식탁 위에 딱 올려두기만 하면 되니까 빼먹을 일은 없겠어요. 60정에 29,900원이면 굳이 여러 통 사서 유통기한 넘겨 버리는 것보다 가성비도 훨씬 좋고요. 그럼 일단 한 번 먹어볼게요. 주문은 어디서 하면 되나요?"
    }
  ],
  "ended_by": "turn_limit"
}