{
  "session_id": "conv-strategy-strategy_3_authority_differentiation-P001",
  "strategy_id": "strategy-strategy_3_authority_differentiation",
  "persona_id": "P001",
  "turns": [
    {
      "role": "agent",
      "content": "안녕하세요! 혹시 지금 챙겨 드시고 계신 영양제의 뒷면 라벨에서 'GMP 인증 마크'나 성분별 함량을 꼼꼼히 확인해 보신 적 있으신가요?\n\n건강을 위해 드시는 제품인 만큼, 성분이 실제로 함량대로 들어있는지, 그리고 제조 과정은 안전한지 따져보는 것이 정말 중요하거든요. 저희 '바이탈케어 데일리 멀티비타민'은 식약처가 인증한 국내 GMP 시설에서 생산되어 라벨에 기재된 함량을 100% 보장하는 제품입니다. 혹시 평소 영양제를 고르실 때 특별히 신경 쓰시는 부분이 있으신가요?"
    },
    {
      "role": "persona",
      "content": "인증 마크나 제조 시설 중요한 건 알겠는데요. 사실 제가 지금 당장 궁금한 건 그런 거창한 설명보다는, 이게 제 생활에 얼마나 실질적인 도움이 되느냐거든요.\n\n야간 알바 끝나고 바로 아침 수업 들어가면 카페인 없인 버티기가 힘든데, 솔직히 지금은 그냥 편의점에서 파는 비타민 음료 한 병 마시고 버티거든요. 이거 한 통 사면 며칠 분량이고, 하루에 나가는 돈으로 치면 얼마 정도예요? 편의점 음료보다 가성비가 확실히 나은지부터 좀 알고 싶네요."
    },
    {
      "role": "agent",
      "content": "솔직한 고민 말씀해 주셔서 감사합니다. 야간 근무와 학업을 병행하시느라 정말 고생이 많으시네요.\n\n저희 '바이탈케어 데일리 멀티비타민'은 한 통에 60정, 즉 두 달(60일) 분량입니다. 가격은 29,900원이니 하루로 치면 딱 500원꼴이죠. 매일 편의점에서 비타민 음료를 사 드시는 비용과 비교하면 훨씬 경제적일 뿐만 아니라, 단순히 카페인으로 각성 효과를 내는 음료와는 근본적인 차이가 있습니다.\n\n일반 음료가 일시적인 기분 전환이라면, 이 제품은 피로 회복을 돕는 고함량 비타민 B군과 면역을 위한 아연, 비타민D가 체내에 꾸준히 쌓이도록 설계되었습니다. 특히 아침 식후 하루 1정만 챙기시면 되니, 따로 음료를 구매하는 번거로움과 비용을 줄이면서 훨씬 효율적으로 컨디션을 관리하실 수 있을 거예요. 직접 경험해 보시고 효과가 만족스럽지 않다면 30일 이내 환불도 가능하니, 부담 없이 시작해 보셔도 좋을 것 같습니다."
    },
    {
      "role": "persona",
      "content": "하루 500원이면 편의점 음료보다 훨씬 싸긴 하네요. 음료는 한 번 마시면 2~3시간 반짝하고 다시 쳐지는데, 이게 비타민 B군 위주면 에너지 대사를 돕는 거니까 좀 더 지속력은 있겠네요.\n\n근데 궁금한 게, 제가 밤새우고 아침 수업 들을 때 카페인을 아예 끊을 순 없거든요. 이거 먹으면서 커피 줄이는 용도로 괜찮을까요? 아니면 이거 먹고도 결국 카페인 힘을 빌려야 하는 수준인가요? 60일치면 딱 두 달인데, 먹다가 효과 없으면 바로 환불해 준다는 건 확실한 거죠?"
    },
    {
      "role": "agent",
      "content": "날카로운 질문이시네요. 우선 환불 정책부터 말씀드리면, 제품에 자신이 있기에 30일 이내에는 어떤 이유로든 100% 환불을 보장해 드리고 있습니다. 그만큼 품질에 확신이 있다는 뜻이니 안심하셔도 좋습니다.\n\n카페인 의존도에 관해서는, 이 제품이 커피를 즉각적으로 대체한다기보다는 '카페인이 필요한 상황을 줄여주는' 역할을 한다고 보시면 됩니다. 비타민 B군은 체내 에너지 대사를 활성화해 피로를 근본적으로 개선해주기 때문에, 지금처럼 카페인으로 억지로 에너지를 쥐어짜는 것보다 훨씬 안정적인 컨디션을 유지하게 도와줍니다.\n\n처음부터 커피를 완전히 끊기보다는, 이 제품으로 몸의 에너지 대사를 바로잡으면서 자연스럽게 카페인 섭취량을 조금씩 줄여나가 보시는 건 어떨까요? 몸이 훨씬 가벼워지는 것을 느끼시면 자연스레 커피 의존도도 낮아지실 겁니다. 오늘 바로 시작해 보시겠어요?"
    },
    {
      "role": "persona",
      "content": "일단 환불 조건이 명확하니까 마음은 좀 놓이네요. 30일이면 제 몸에 맞는지 안 맞는지 확인하기엔 충분한 시간이기도 하고요.\n\n하루 500원이면 편의점 음료 한 병값도 안 되니까, 말씀하신 대로 카페인 의존도만 좀 낮춰도 손해 볼 장사는 아니겠네요. 야간 알바 끝나고 수업 들어갈 때 멍한 게 제일 문제인데, 비타민 B군으로 대사가 좀 돌아오면 확실히 지금보다는 낫겠죠. 일단 한 통 사서 두 달 먹어볼게요. 구매는 어디서 하면 되나요? 결제하고 나서 바로 배송 시작되는 거죠?"
    }
  ],
  "ended_by": "turn_limit"
}