{
  "session_id": "conv-strategy-fallback-P007",
  "strategy_id": "strategy-fallback",
  "persona_id": "P007",
  "turns": [
    {
      "role": "agent",
      "content": "[LLM ERROR] Gemini HTTP 400: {\n  \"error\": {\n    \"code\": 400,\n    \"message\": \"API key expired. Please renew the API key.\",\n    \"status\": \"INVALID_ARGUMENT\",\n    \"details\": [\n      {\n        \"@type\": \"type.googleapis.com/google.rpc.ErrorInfo\",\n        \"reason\": \"API_KEY_INVALID\",\n        \"domain\": \"googleapis.com\",\n        \"metadata\": {\n          \"service\": \"generativelanguage.googleapis.com\"\n        }\n      },\n      {\n        \"@type\": \"type.googleapis.com/google.rpc.LocalizedMessage\",\n        \"locale\": \"en-US\",\n        \"mess"
    },
    {
      "role": "persona",
      "content": "[LLM ERROR] Gemini HTTP 400: {\n  \"error\": {\n    \"code\": 400,\n    \"message\": \"API key expired. Please renew the API key.\",\n    \"status\": \"INVALID_ARGUMENT\",\n    \"details\": [\n      {\n        \"@type\": \"type.googleapis.com/google.rpc.ErrorInfo\",\n        \"reason\": \"API_KEY_INVALID\",\n        \"domain\": \"googleapis.com\",\n        \"metadata\": {\n          \"service\": \"generativelanguage.googleapis.com\"\n        }\n      },\n      {\n        \"@type\": \"type.googleapis.com/google.rpc.LocalizedMessage\",\n        \"locale\": \"en-US\",\n        \"mess"
    },
    {
      "role": "agent",
      "content": "[LLM ERROR] Gemini HTTP 400: {\n  \"error\": {\n    \"code\": 400,\n    \"message\": \"API key expired. Please renew the API key.\",\n    \"status\": \"INVALID_ARGUMENT\",\n    \"details\": [\n      {\n        \"@type\": \"type.googleapis.com/google.rpc.ErrorInfo\",\n        \"reason\": \"API_KEY_INVALID\",\n        \"domain\": \"googleapis.com\",\n        \"metadata\": {\n          \"service\": \"generativelanguage.googleapis.com\"\n        }\n      },\n      {\n        \"@type\": \"type.googleapis.com/google.rpc.LocalizedMessage\",\n        \"locale\": \"en-US\",\n        \"mess"
    },
    {
      "role": "persona",
      "content": "[LLM ERROR] Gemini HTTP 400: {\n  \"error\": {\n    \"code\": 400,\n    \"message\": \"API key expired. Please renew the API key.\",\n    \"status\": \"INVALID_ARGUMENT\",\n    \"details\": [\n      {\n        \"@type\": \"type.googleapis.com/google.rpc.ErrorInfo\",\n        \"reason\": \"API_KEY_INVALID\",\n        \"domain\": \"googleapis.com\",\n        \"metadata\": {\n          \"service\": \"generativelanguage.googleapis.com\"\n        }\n      },\n      {\n        \"@type\": \"type.googleapis.com/google.rpc.LocalizedMessage\",\n        \"locale\": \"en-US\",\n        \"mess"
    },
    {
      "role": "agent",
      "content": "[LLM ERROR] Gemini HTTP 400: {\n  \"error\": {\n    \"code\": 400,\n    \"message\": \"API key expired. Please renew the API key.\",\n    \"status\": \"INVALID_ARGUMENT\",\n    \"details\": [\n      {\n        \"@type\": \"type.googleapis.com/google.rpc.ErrorInfo\",\n        \"reason\": \"API_KEY_INVALID\",\n        \"domain\": \"googleapis.com\",\n        \"metadata\": {\n          \"service\": \"generativelanguage.googleapis.com\"\n        }\n      },\n      {\n        \"@type\": \"type.googleapis.com/google.rpc.LocalizedMessage\",\n        \"locale\": \"en-US\",\n        \"mess"
    },
    {
      "role": "persona",
      "content": "[LLM ERROR] Gemini HTTP 400: {\n  \"error\": {\n    \"code\": 400,\n    \"message\": \"API key expired. Please renew the API key.\",\n    \"status\": \"INVALID_ARGUMENT\",\n    \"details\": [\n      {\n        \"@type\": \"type.googleapis.com/google.rpc.ErrorInfo\",\n        \"reason\": \"API_KEY_INVALID\",\n        \"domain\": \"googleapis.com\",\n        \"metadata\": {\n          \"service\": \"generativelanguage.googleapis.com\"\n        }\n      },\n      {\n        \"@type\": \"type.googleapis.com/google.rpc.LocalizedMessage\",\n        \"locale\": \"en-US\",\n        \"mess"
    }
  ],
  "ended_by": "turn_limit"
}