{
  "session_id": "conv-strategy-strategy_1_ROI_simplification-P007",
  "strategy_id": "strategy-strategy_1_ROI_simplification",
  "persona_id": "P007",
  "turns": [
    {
      "role": "agent",
      "content": "고객님, 안녕하세요! 혹시 매달 건강을 위해 챙겨 드시는 영양제나, 습관처럼 마시는 커피값으로 지출하시는 금액이 대략 얼마 정도인지 계산해 보신 적 있으신가요? \n\n사실 하루 커피 한 잔 값만 아껴도 한 달이면 10만 원이 훌쩍 넘는데, 그 돈으로 건강까지 완벽하게 챙기기는 쉽지 않죠. 그래서 오늘은 스마트한 직장인들 사이에서 입소문 난 '바이탈케어 데일리 멀티비타민'을 소개해 드리려고 합니다. 혹시 평소에 피로감이나 눈 건강 때문에 고민이 많으셨나요?"
    },
    {
      "role": "persona",
      "content": "커피값 계산은 됐습니다. 어차피 그 카페인은 오후 버티기용이라 못 끊습니다.\n\n그 '바이탈케어'라는 거, 하루에 몇 알 먹어야 합니까? 그리고 1일 섭취 비용으로 따지면 정확히 얼마죠? 지금 먹는 종합비타민 하나가 있는데, 그거랑 비교해서 오후에 쏟아지는 피로감이 얼마나 체감될지 그게 궁금합니다. 성분 나열 말고, 딱 먹었을 때 내일 아침 컨디션에 어떻게 반영되는지 정리해서 말해줘요."
    },
    {
      "role": "agent",
      "content": "오후의 피로를 버티기 위해 커피가 꼭 필요하시군요. 이해합니다. 바이탈케어는 하루 딱 1정, 아침 식후에 드시면 됩니다. 가격은 60정(2개월분)에 29,900원이니, 하루 약 500원꼴로 커피 한 잔보다 훨씬 경제적이죠.\n\n지금 드시는 영양제와 비교하자면, 저희 제품은 '피로 회복'의 핵심인 고함량 비타민 B군을 체내 흡수율이 높은 형태로 설계했습니다. 기존 비타민이 단순히 '영양 보충'에 그쳤다면, 바이탈케어는 아침에 드셨을 때 오후 3~4시쯤 찾아오는 소위 '식곤증과 멍한 느낌'을 줄여주는 데 집중했습니다. \n\n내일 아침 컨디션으로 말씀드리면, 기상 직후 몸이 무겁게 가라앉는 느낌이 덜하고, 낮 시간 동안 카페인 의존도를 서서히 낮출 수 있는 활력을 느끼실 겁니다. 혹시라도 체감이 안 되시면 30일 내 100% 환불해 드리니, 밑져야 본전이라는 생각으로 기존 제품과 딱 한 달만 교체해서 비교해 보시는 건 어떨까요?"
    },
    {
      "role": "persona",
      "content": "하루 500원이라, 가격은 일단 납득 가능한 범위네요. \n\n지금 먹는 건 비타민 B군 함량이 낮아서 그런지 오후만 되면 머리가 멍해지는데, 고함량 설계라는 게 구체적으로 어느 정도인가요? 단순히 함량만 높은 게 아니라 흡수율을 높였다고 하셨는데, 그게 정확히 어떤 방식인지 짧게만 확인하겠습니다.\n\n이게 기존 루틴에 끼어들어서 번거로울 일은 없을 것 같으니, 성분만 확인되면 바로 한 번 시도해 보죠. 내일 아침부터 바로 먹어볼 수 있게 배송은 얼마나 걸립니까?"
    },
    {
      "role": "agent",
      "content": "좋은 질문입니다. 비타민 B군은 양도 중요하지만 '활성형'인지가 핵심입니다. 바이탈케어는 체내 흡수율이 높은 활성형 비타민 B군을 일일 권장량 대비 수백 퍼센트(고함량)로 배합하여, 대사 과정에서 낭비 없이 바로 에너지로 전환되도록 설계했습니다. 덕분에 오후에 머리가 멍해지는 '브레인 포그' 현상을 방지하는 데 최적화되어 있죠.\n\n배송은 오늘 오후 3시 이전 주문 건까지 당일 출고되어, 보통 다음 날이면 받아보실 수 있습니다. 30일 환불 보장 제도가 있으니, 일단 내일 아침부터 딱 1정 드셔보시고 오후 컨디션이 어떻게 달라지는지 직접 경험해 보세요. 바로 구매 도와드릴까요?"
    },
    {
      "role": "persona",
      "content": "3시 전 주문하면 내일 도착한다는 거죠? 일단 한 통만 사서 테스트해보겠습니다.\n\n활성형 비타민 B군 위주로 구성됐고, 함량이 높아서 에너지 전환이 빠르다는 점은 납득했습니다. 오후에 머리 멍한 것만 좀 덜해도 업무 효율은 확실히 달라질 테니까요. 30일 환불 보장이라고 하셨으니, 먹어보고 효과 없으면 바로 정리하겠습니다. \n\n결제 링크 보내주세요. 지금 바로 처리하고 퇴근하겠습니다."
    }
  ],
  "ended_by": "turn_limit"
}