{
  "session_id": "conv-strategy-ROI_Value_Driven-P002",
  "strategy_id": "strategy-ROI_Value_Driven",
  "persona_id": "P002",
  "turns": [
    {
      "role": "agent",
      "content": "안녕하세요! 바쁜 일상 속에서 건강 챙기느라 애쓰고 계시죠? 혹시 매일 챙겨 드시는 영양제, 매달 고정적으로 나가는 유지 비용이 은근히 부담되지는 않으신가요?"
    },
    {
      "role": "persona",
      "content": "부담 안 된다면 거짓말이죠. 지금은 비타민이랑 카페인으로 겨우 버티고 있는데, 문제는 점심 먹고 나면 오후 3시쯤부터 눈이 무겁고 집중력이 확 떨어지는 게 고민입니다.\n\n혹시 지금 말씀하시는 제품은 커피처럼 일시적으로 각성만 시키는 건가요? 아니면 오후 4시, 5시쯤 퇴근 보고할 때까지 머리가 덜 흐트러지게 잡아주는 쪽인가요? 하루 섭취 비용이 얼마인지, 그리고 구체적으로 어느 시간대에 체감이 오는지부터 알려주세요."
    },
    {
      "role": "agent",
      "content": "바이탈케어는 카페인처럼 일시적인 각성을 유도하는 제품이 아닙니다. 오히려 체내 에너지 대사를 돕는 고함량 비타민 B군이 아침 식후 섭취를 통해 하루 종일 기초 에너지를 유지해주고, 루테인이 오후의 눈 피로를 덜어주어 퇴근 시간까지 집중력을 안정적으로 가져갈 수 있게 설계되었습니다.\n\n하루 섭취 비용은 약 500원꼴로, 2개월분인 60정에 29,900원입니다. \n\n바이탈케어는 하루 500원으로 커피 한 잔 값의 10분의 1도 안 됩니다. 그런데 이 한 알에 피로회복을 위한 비타민 B군 고함량부터 눈 건강을 위한 루테인, 면역력을 돕는 아연까지 꽉 채워져 있어 가성비 면에서 확실한 대안이 될 겁니다. 30일 내 불만족 시 환불도 가능하니, 오후의 무거운 눈과 집중력 저하가 고민이시라면 한 번 경험해 보시는 건 어떨까요?"
    },
    {
      "role": "persona",
      "content": "하루 500원꼴이면 확실히 커피 한 잔 값보다는 훨씬 경제적이네요. 제가 지금 편의점 커피를 하루에 두 잔씩은 마시는데, 그걸 줄이고 이걸로 대체했을 때 오후 3시 이후의 '피로도'가 얼마나 유의미하게 잡히느냐가 관건이겠네요.\n\n궁금한 게 있는데, 비타민 B군 함량이 높다고 하셨잖아요. 이게 점심 지나서 식곤증 몰려올 때 커피처럼 머리가 맑아지는 느낌을 주는 건가요, 아니면 그냥 몸이 덜 무겁게 느껴지는 정도인가요? 제가 퇴근 전 보고할 때 멍해지는 게 제일 문제라서요. 아침에 먹으면 그 집중력이 퇴근 시간까지 어느 정도 유지되는지 실제 체감 패턴이 궁금합니다."
    },
    {
      "role": "agent",
      "content": "커피가 카페인으로 뇌를 억지로 깨우는 방식이라면, 바이탈케어는 비타민 B군을 통해 세포 단위의 에너지 대사를 활성화하여 몸의 '기초 체력'을 끌어올리는 방식입니다. 따라서 갑자기 머리가 쨍하게 맑아지는 각성 효과보다는, 퇴근 무렵에도 몸이 처지지 않고 집중력을 유지할 수 있는 '지치지 않는 컨디션'을 체감하시게 될 겁니다.\n\n보통 아침 식후에 한 알을 드시면, 오후 3~4시경 겪으시는 그 무거운 느낌과 멍해지는 현상이 한결 가벼워지는 것을 느끼실 거예요. 억지로 밀어붙이는 것이 아니라, 우리 몸이 스스로 에너지를 내도록 돕는 것이니까요. 30일 환불 보장 제도가 있으니, 실제 퇴근 전 업무 집중력에 얼마나 도움이 되는지 딱 한 달만 직접 시험해 보시는 건 어떨까요?"
    },
    {
      "role": "persona",
      "content": "커피로 억지로 끌어올리는 각성은 오후 4시 넘어가면 오히려 심장이 두근거리거나 퇴근 후에 훅 가라앉는 부작용이 있어서 좀 불안했거든요. 세포 단위 에너지 대사라는 게 퇴근 전 멍해지는 현상을 막아주는 거라면, 일단 지금 루틴보다는 훨씬 합리적인 것 같네요.\n\n30일 환불 보장이면 리스크는 적어 보이는데, 이게 아침에 챙겨 먹기 번거롭지는 않나요? 제가 워낙 정신이 없어서 한 알로 끝나는 건지, 아니면 시간 맞춰 여러 번 나눠 먹어야 하는 건지 궁금합니다. 그리고 혹시 이거 먹고 나서 속 쓰림 같은 건 없었나요? 비타민 B군 고함량 제품들 중에 공복이나 식후에 먹어도 유독 속이 불편한 것들이 있어서요."
    }
  ],
  "ended_by": "turn_limit"
}