{
  "session_id": "conv-strategy-strategy_3_authority_differentiation-P003",
  "strategy_id": "strategy-strategy_3_authority_differentiation",
  "persona_id": "P003",
  "turns": [
    {
      "role": "agent",
      "content": "안녕하세요! 건강 관리에 관심이 많으신 것 같아 인사드립니다. 혹시 지금 드시고 계신 영양제의 뒷면 라벨에서 'GMP 인증 마크'나 성분별 함량을 꼼꼼히 확인해 보신 적 있으신가요? \n\n요즘은 영양제도 단순히 '좋다'는 말보다는 실제 어떤 성분이 어떻게 설계되었는지를 따져보는 것이 정말 중요하더라고요. 지금 어떤 제품을 챙겨 드시고 계신지, 혹은 평소 영양제를 고를 때 어떤 점을 가장 중요하게 보시는지 궁금합니다."
    },
    {
      "role": "persona",
      "content": "라벨 뒷면 함량 따지는 건 기본이죠. 근데 사실 저 같은 워킹맘은 성분보다 '얼마나 안 빼먹고 챙길 수 있느냐'가 더 문제거든요. 지금 유산균 따로, 비타민 따로, 오메가3까지 챙기려니 아침마다 정신없어서 결국 반은 까먹고 유통기한 지나 버리는 게 태반이에요.\n\n그래서 묻는 건데, 지금 제 루틴에서 뭘 줄일 수 있다는 건가요? 하루에 딱 몇 알만 먹으면 되는지, 그리고 하루치 비용으로 따지면 대략 얼마 정도인지 바로 말씀해 주실 수 있을까요? 복잡한 성분 설명보다 그게 더 궁금하네요."
    },
    {
      "role": "agent",
      "content": "바쁘신 아침에 여러 알 챙겨 드시느라 고생이 많으셨군요. 결론부터 말씀드리면, **'바이탈케어 데일리 멀티비타민'은 하루 딱 1알**로 충분합니다.\n\n이 제품 하나면 피로 회복을 위한 고함량 비타민 B군부터 면역력을 위한 아연·비타민D, 그리고 현대인에게 필수인 루테인까지 모두 챙기실 수 있습니다. 매번 영양제를 챙기느라 애쓰는 수고를 덜어드리는 것이죠. 가격은 60정(2개월분)에 29,900원으로, **하루 약 500원꼴**이라 경제적인 부담도 훨씬 적으실 겁니다.\n\n성분 설계가 꼼꼼히 되어 있어 기존에 드시던 비타민이나 눈 영양제를 따로 챙길 필요가 없으니, 아침 루틴이 훨씬 간편해질 거예요. 혹시 드셔보시고 만족스럽지 않으시다면 30일 이내 환불도 보장해 드리고 있으니, 이번 기회에 복잡한 영양제 가짓수를 한번 줄여보시는 건 어떨까요?"
    },
    {
      "role": "persona",
      "content": "하루 500원이면 지금 먹던 비타민이랑 눈 영양제 값 합친 것보다 확실히 저렴하네요. 무엇보다 아침에 이것저것 꺼낼 필요 없이 딱 한 알만 먹으면 된다는 게 제일 끌립니다. \n\n그런데 궁금한 게, 제가 지금 먹는 오메가3는 따로 챙겨야 하나요? 아니면 이 제품 안에 오메가3까지 포함된 구성인 건가요? 만약 이것만으로 다른 걸 다 끊어도 된다면 아침 전쟁이 훨씬 줄어들 것 같아서요. 그리고 이거 낱개 포장인가요, 아니면 통에 들어있는 형태인가요? 출근 준비하면서 정신없을 때 통 열고 꺼내는 것도 일이라서요."
    },
    {
      "role": "agent",
      "content": "좋은 질문입니다. '바이탈케어 데일리 멀티비타민'에는 오메가3가 포함되어 있지 않습니다. 오메가3는 성분 특성상 캡슐 크기가 크고 유지 관리가 까다로워, 종합 비타민과 함께 드실 때는 별도로 챙기시는 것을 권장해 드립니다. 다만, 비타민 B군과 루테인, 면역 성분을 한 알로 합쳤기 때문에 기존에 따로 드시던 비타민제와 눈 영양제는 이제 생략하셔도 충분합니다.\n\n제품은 안전성과 위생을 고려하여 통에 담긴 형태로 제공됩니다. 다만, 하루 한 알만 꺼내시면 되기에 아침 동선에 맞춰 식탁이나 정수기 옆에 두시면 훨씬 간편하실 거예요. 무엇보다 식약처에서 우수 건강기능식품 제조 기준으로 인정한 국내 GMP 시설에서 생산되어, 라벨에 기재된 성분 함량이 100% 보장되니 안심하고 드셔도 좋습니다.\n\n번거로운 영양제 가짓수를 줄여서 아침 시간의 여유를 찾는 것만으로도 큰 변화가 될 텐데, 이번 기회에 한번 시도해 보시는 건 어떨까요?"
    },
    {
      "role": "persona",
      "content": "오메가3는 따로 챙겨야 하는군요. 아무래도 그건 기름 성분이라 한 알에 다 넣기 어렵다는 건 저도 알아요. 그래도 비타민이랑 눈 영양제만 빠져도 영양제 통 꺼내는 횟수가 확 줄겠네요.\n\n그런데 통에 들어있는 형태라면, 제가 아침에 정신없어서 뚜껑 열어놓고 출근할까 봐 그게 좀 걱정되거든요. 혹시 낱개 포장(PTP) 형태로 된 옵션은 따로 없나요? 아니면 이 제품으로 바꿨을 때, 기존에 먹던 오메가3까지 합쳐서 제가 하루에 딱 두 알만 먹고 끝내면 되는 구조인 거죠? \n\n계산해보니 기존에 먹던 것들 다 정리하고 이거 하나랑 오메가3만 챙기면, 아침에 영양제 통 3~4개씩 꺼내던 것보다는 확실히 덜 번거롭긴 하겠네요. 이거 주문하면 배송은 얼마나 걸리나요? 아이들 학원비 나가는 날 전후로 예산을 맞추는 편이라서요."
    }
  ],
  "ended_by": "turn_limit"
}