{
  "session_id": "conv-strategy-EXPERT_AUTHORITY-P001",
  "strategy_id": "strategy-EXPERT_AUTHORITY",
  "persona_id": "P001",
  "turns": [
    {
      "role": "agent",
      "content": "안녕하세요! 평소 건강기능식품을 고르실 때 성분표나 함량을 꼼꼼히 확인하시는 편인가요?\n\n바쁜 현대인들에게 가장 부족해지기 쉬운 '피로 회복을 위한 비타민 B군', '면역력을 위한 아연과 비타민 D', 그리고 '눈 건강을 위한 루테인'까지, 이 3대 핵심 성분만을 식약처 기준에 맞춰 과학적으로 배합한 '바이탈케어 데일리 멀티비타민'을 소개해 드립니다. 혹시 평소에 건강 관리를 위해 따로 챙겨 드시는 영양제가 있으신가요?"
    },
    {
      "role": "persona",
      "content": "아니요, 따로 챙겨 먹는 건 없고 그냥 편의점에서 파는 비타민 음료 한 병씩 사 마시는 게 전부예요. 시험 기간이나 야간 알바 끝나고 도저히 안 되겠다 싶을 때 마시는데, 사실 그게 카페인 빨인 거 알면서도 그냥 버티는 거거든요.\n\n말씀하신 그 '바이탈케어'라는 거, 한 통 사면 며칠분이고 하루에 얼마 꼴로 계산되는 건가요? 괜히 이것저것 섞여서 비싸기만 한 거면 차라리 편의점 음료가 나을 것 같아서요. 그리고 이거 먹으면 야간 알바 끝나고 아침 수업 들어갈 때 좀 덜 피곤한가요? 구체적으로 뭐가 다른지 궁금하네요."
    },
    {
      "role": "agent",
      "content": "편의점 음료는 일시적인 카페인 각성 효과는 주지만, 근본적인 에너지 대사를 돕지는 못해 마실수록 몸이 더 축나기 마련이죠. '바이탈케어 데일리 멀티비타민'은 총 60정, 즉 두 달분으로 구성되어 있어 하루 약 500원꼴로 매우 경제적입니다. \n\n단순히 카페인으로 버티는 것과 달리, 비타민 B군이 체내 에너지 생성 과정을 직접 활성화해주기 때문에 아침에 느끼시는 무거운 피로감이 훨씬 덜하실 겁니다. 특히 국내 GMP 인증 시설에서 엄격하게 생산되어 성분 간의 충돌 없이 시너지를 내도록 설계되었으니, 매일 아침 식후 한 알로 편의점 음료보다 훨씬 건강하고 효율적인 컨디션 관리가 가능하실 거예요. 30일 환불 보장 제도도 운영하고 있으니, 직접 몸으로 느껴보시고 결정하셔도 좋습니다."
    },
    {
      "role": "persona",
      "content": "60정에 두 달 분이면 하루 500원꼴이라는 건데, 편의점에서 비타민 음료 한 병 사 마시는 게 1,500원~2,000원 하는 거 생각하면 가격 자체는 확실히 싼 편이네요. 음료는 마실 때만 반짝하고 금방 풀리는데, 비타민 B군으로 에너지 대사를 돌린다는 게 무슨 말인지는 알겠어요.\n\n근데 궁금한 게, 제가 야간 알바 끝나고 아침 8~9시쯤 집에 들어오거든요. 그때 바로 먹고 자는 게 나은가요, 아니면 자고 일어나서 수업 가기 전에 먹는 게 나은가요? 이게 먹자마자 바로 효과가 나오는 건지, 아니면 며칠은 꾸준히 먹어야 좀 사람 구실(?)을 할 수 있는 건지 궁금하네요. 환불 보장 된다고는 하셨지만, 일단 챙겨 먹기 번거로우면 또 서랍에 박아둘 것 같아서요."
    },
    {
      "role": "agent",
      "content": "좋은 질문입니다. 결론부터 말씀드리면, **수업 가기 전 아침 식사 직후에 드시는 것을 추천**합니다. 비타민 B군은 에너지 대사를 돕는 성분이라, 활동을 시작하기 전에 섭취해야 하루를 버틸 에너지가 원활하게 생성되기 때문이죠. \n\n효과에 대해 솔직히 말씀드리면, 카페인 음료처럼 즉각적인 '각성'을 기대하기보다는, 며칠간 꾸준히 드시면서 **'아침에 눈뜰 때의 개운함'과 '오후까지 이어지는 체력 유지력'**이 달라지는 것을 느끼실 겁니다. 체내 영양소 농도가 안정화되는 1~2주 정도 지나면 확실히 '사람 구실'을 하는 데 큰 도움이 되실 거예요. 하루 한 알, 식후에 물과 함께 드시기만 하면 되니 번거로움도 최소화했습니다. 직접 2주 정도만 경험해 보셔도 몸이 먼저 반응할 겁니다. 바로 시작해 보시겠어요?"
    },
    {
      "role": "persona",
      "content": "음, 아침 식사 직후에 한 알만 먹으면 된다는 거죠? 일단 챙겨 먹는 게 복잡하면 저도 분명히 안 먹을 게 뻔해서, 하루 한 번인 건 마음에 드네요. \n\n편의점 음료는 마시면 심장만 두근거리고 정작 수업 때는 집중이 안 될 때가 많았거든요. 1~2주 정도 꾸준히 먹어서 체력 유지력이 좀 바뀐다면, 매일 아침 500원으로 카페인 음료 끊는 게 결과적으로는 이득일 것 같긴 해요.\n\n혹시 이거 처음에 주문할 때 따로 할인되는 구성이나, 정기 배송 같은 거 묶어서 더 싸게 사는 방법은 없나요? 어차피 두 달 치면 한 통 다 먹어갈 때쯤 또 고민해야 할 텐데, 계산기 두드려보고 괜찮으면 한 번 시작해 보려고요."
    }
  ],
  "ended_by": "turn_limit"
}