{
  "session_id": "conv-strategy-1-P002",
  "strategy_id": "strategy-1",
  "persona_id": "P002",
  "turns": [
    {
      "role": "agent",
      "content": "안녕하세요! 바쁜 일상 속에서 건강 챙기기 정말 쉽지 않으시죠? 혹시, 하루 커피 한 잔 값도 안 되는 500원으로 내 몸 전체를 위한 투자를 시작할 수 있다면 어떠세요? 피로회복부터 면역력, 그리고 눈 건강까지 한 번에 챙길 수 있는 현명한 방법을 소개해 드리고 싶어서요."
    },
    {
      "role": "persona",
      "content": "[LLM ERROR] Gemini HTTP 429: {\n  \"error\": {\n    \"code\": 429,\n    \"message\": \"You exceeded your current quota, please check your plan and billing details. For more information on this error, head to: https://ai.google.dev/gemini-api/docs/rate-limits. To monitor your current usage, head to: https://ai.dev/rate-limit. \\n* Quota exceeded for metric: generativelanguage.googleapis.com/generate_content_free_tier_requests, limit: 5, model: gemini-2.5-flash\\nPlease retry in 42.070147671s.\",\n    \"status\": \"RESOURCE_EXHAUSTED\",\n    \"d"
    },
    {
      "role": "agent",
      "content": "[LLM ERROR] Gemini HTTP 429: {\n  \"error\": {\n    \"code\": 429,\n    \"message\": \"You exceeded your current quota, please check your plan and billing details. For more information on this error, head to: https://ai.google.dev/gemini-api/docs/rate-limits. To monitor your current usage, head to: https://ai.dev/rate-limit. \\n* Quota exceeded for metric: generativelanguage.googleapis.com/generate_content_free_tier_requests, limit: 5, model: gemini-2.5-flash\\nPlease retry in 41.649914003s.\",\n    \"status\": \"RESOURCE_EXHAUSTED\",\n    \"d"
    },
    {
      "role": "persona",
      "content": "[LLM ERROR] Gemini HTTP 429: {\n  \"error\": {\n    \"code\": 429,\n    \"message\": \"You exceeded your current quota, please check your plan and billing details. For more information on this error, head to: https://ai.google.dev/gemini-api/docs/rate-limits. To monitor your current usage, head to: https://ai.dev/rate-limit. \\n* Quota exceeded for metric: generativelanguage.googleapis.com/generate_content_free_tier_requests, limit: 5, model: gemini-2.5-flash\\nPlease retry in 41.225205081s.\",\n    \"status\": \"RESOURCE_EXHAUSTED\",\n    \"d"
    },
    {
      "role": "agent",
      "content": "[LLM ERROR] Gemini HTTP 429: {\n  \"error\": {\n    \"code\": 429,\n    \"message\": \"You exceeded your current quota, please check your plan and billing details. For more information on this error, head to: https://ai.google.dev/gemini-api/docs/rate-limits. To monitor your current usage, head to: https://ai.dev/rate-limit. \\n* Quota exceeded for metric: generativelanguage.googleapis.com/generate_content_free_tier_requests, limit: 5, model: gemini-2.5-flash\\nPlease retry in 40.795797529s.\",\n    \"status\": \"RESOURCE_EXHAUSTED\",\n    \"d"
    },
    {
      "role": "persona",
      "content": "[LLM ERROR] Gemini HTTP 429: {\n  \"error\": {\n    \"code\": 429,\n    \"message\": \"You exceeded your current quota, please check your plan and billing details. For more information on this error, head to: https://ai.google.dev/gemini-api/docs/rate-limits. To monitor your current usage, head to: https://ai.dev/rate-limit. \\n* Quota exceeded for metric: generativelanguage.googleapis.com/generate_content_free_tier_requests, limit: 5, model: gemini-2.5-flash\\nPlease retry in 40.339416414s.\",\n    \"status\": \"RESOURCE_EXHAUSTED\",\n    \"d"
    }
  ],
  "ended_by": "turn_limit"
}