{
  "session_id": "conv-strategy-strategy_1_empathy_simplicity-P001",
  "strategy_id": "strategy-strategy_1_empathy_simplicity",
  "persona_id": "P001",
  "turns": [
    {
      "role": "agent",
      "content": "안녕하세요! 요즘 바쁜 일상 보내시느라 고생이 많으시죠. 혹시 최근 들어 아침에 일어날 때 몸이 평소보다 무겁거나, 오후쯤 눈이 뻑뻑하다고 느끼신 적 있으신가요? \n\n건강을 챙기고는 싶은데 이것저것 챙겨 먹기가 참 쉽지 않잖아요. 혹시 평소에 건강 관리를 위해 따로 챙겨 드시는 게 있으신지 궁금합니다."
    },
    {
      "role": "persona",
      "content": "아, 네. 야간 알바하고 바로 수업 들어가면 솔직히 안 무거운 날이 없죠. 지금은 그냥 편의점에서 파는 비타민 음료나 카페인 좀 센 걸로 때우면서 버티고 있어요. \n\n따로 챙겨 먹는 건 딱히 없는데, 가끔 저가형 멀티비타민 한 통 사서 먹긴 하거든요. 근데 사실 이게 진짜 효과가 있는 건지, 아니면 그냥 기분 탓인지 잘 모르겠어서요. 지금 제 상황에서 굳이 기존에 먹던 거 대신 이걸로 바꿔야 할 이유가 있을까요? 하루에 들어가는 비용이랑, 그거 먹으면 지금 마시는 음료 대비 뭐가 구체적으로 나은지부터 좀 알고 싶네요."
    },
    {
      "role": "agent",
      "content": "야간 알바와 학업을 병행하시느라 정말 고생이 많으시네요. 카페인이나 비타민 음료는 당장 잠을 깨워주지만, 사실 몸의 에너지를 빌려 쓰는 거라 시간이 지날수록 피로가 더 쌓일 수 있거든요.\n\n'바이탈케어 데일리 멀티비타민'은 하루 딱 1정으로, 카페인처럼 반짝 효과를 내는 게 아니라 비타민 B군 고함량 배합으로 체내 에너지 대사를 근본적으로 도와줍니다. 특히 모니터를 많이 보시는 환경이라면 눈 건강을 위한 루테인까지 포함되어 있어 따로 챙길 번거로움이 없죠. 가격은 60정에 29,900원이라 하루 약 500원꼴인데, 매번 편의점에서 음료 사 드시는 비용보다 훨씬 경제적이면서 몸에는 훨씬 이롭습니다.\n\n바쁜 아침에 물 한 잔과 함께 딱 한 알만 드시면 되니, 이것저것 챙길 필요 없이 아침 루틴으로 아주 간편하실 거예요. 혹시 드셔보시고 몸이 좀 가벼워지는 느낌이 안 드시면 30일 이내로 언제든 환불도 가능하니, 큰 부담 없이 한번 경험해보시는 건 어떨까요?"
    },
    {
      "role": "persona",
      "content": "하루 500원이면 편의점 음료 하나보다 확실히 싸긴 하네요. 음료는 한 번 마시면 카페인 떨어지자마자 다시 쳐지는데, 이건 에너지 대사를 돕는 거라니까 그 부분은 좀 솔깃합니다.\n\n그런데 루테인이랑 비타민 B군이 같이 들어있다고 하셨는데, 이게 제가 지금 먹는 저가형 멀티비타민보다 함량이나 흡수율 면에서 얼마나 차이가 나는 건가요? 솔직히 싼 게 비지떡일까 봐 걱정되는 거라, 단순히 '좋다'는 말 말고 제가 체감할 수 있는 성분 차이가 뭔지 좀 더 구체적으로 알려주실 수 있을까요? 그리고 이거 한 통이면 딱 두 달 치인 거죠?"
    },
    {
      "role": "agent",
      "content": "네, 맞습니다. 한 통에 60정이니 하루 한 알씩 드시면 딱 두 달 동안 든든하게 챙기실 수 있어요.\n\n저가형 제품과 가장 큰 차이는 '흡수율을 고려한 활성형 비타민 B군'과 '복합 기능성'에 있습니다. 시중의 저렴한 제품들은 일반 비타민을 사용하는 경우가 많은데, 저희 제품은 체내 이용률이 높은 고함량 비타민 B군을 사용하여 에너지 전환 속도가 훨씬 빠릅니다. 덕분에 카페인처럼 일시적인 각성이 아니라, 오후에도 피로감이 덜하고 눈의 침침함이 완화되는 것을 체감하실 수 있을 거예요.\n\n단순히 비타민만 들어있는 게 아니라, 눈 건강을 위한 루테인과 면역력을 위한 비타민D, 아연까지 한 알에 담았기 때문에 여러 통을 늘어놓고 고민할 필요가 없습니다. 저가형 제품을 드실 때와 달리, '아침에 일어날 때 한결 개운하다'는 느낌을 받으시는 게 가장 큰 차이가 아닐까 싶습니다. 30일 환불 보장 제도도 있으니, 직접 몸으로 느껴보시고 결정하셔도 늦지 않습니다. 지금 바로 시작해보시는 건 어떠세요?"
    },
    {
      "role": "persona",
      "content": "음, 활성형 비타민 B군이랑 루테인까지 같이 들어가 있는 거면 저가형보다는 확실히 구성이 낫긴 하네요. 저가형 먹을 때는 솔직히 먹으나 마나 한 느낌이었거든요. \n\n근데 제가 야간 알바 끝나고 바로 수업 들어가면 진짜 눈이 너무 뻑뻑해서 루테인을 따로 사야 하나 고민했었거든요. 이게 한 알에 다 들어있으면 눈이랑 피로감 둘 다 커버가 된다는 거죠? 60정에 29,900원이면, 하루 500원꼴로 편의점 비타민 음료 하나 값도 안 되는 건 확실히 계산이 서네요.\n\n이거 아침에 공복에 먹어도 속 쓰림 같은 건 없나요? 제가 위가 좀 예민한 편이라 빈속에 먹어도 괜찮은지 궁금합니다. 그리고 지금 주문하면 바로 배송되는 거죠?"
    }
  ],
  "ended_by": "turn_limit"
}