{
  "session_id": "conv-strategy-strategy_1_empathy_simplicity-P009",
  "strategy_id": "strategy-strategy_1_empathy_simplicity",
  "persona_id": "P009",
  "turns": [
    {
      "role": "agent",
      "content": "안녕하세요! 혹시 최근 들어 아침에 일어날 때 몸이 평소보다 무겁거나, 오후쯤 눈이 뻑뻑하다고 느끼신 적 있으신가요? 바쁜 일상 속에서 건강 챙기기가 쉽지 않으실 텐데, 잠깐 이야기 나눠볼 수 있을까요?"
    },
    {
      "role": "persona",
      "content": "안녕하세요. 몸이 무겁거나 눈이 피로한 건 저도 늘 신경 쓰는 부분이라 딱히 부정할 순 없겠네요. \n\n다만, 지금 이미 아침엔 종합비타민, 점심 이후엔 오메가3와 루테인을 챙기고 있는 루틴이 있습니다. 새로 제안하시는 제품이 있다면, 제가 지금 먹는 구성에서 어떤 성분이 얼마나 겹치는지, 그리고 이걸 추가했을 때 기존 제품 중 하나를 빼도 될 만큼 함량이나 효율 면에서 대체가 가능한지 궁금합니다. 단순히 '좋다'는 설명보다는, 제 현재 루틴에서 어떤 부분을 정리하고 이걸로 갈아타는 게 실익이 있을지 비교표나 구체적인 수치로 먼저 확인해주시겠어요?"
    },
    {
      "role": "agent",
      "content": "현재 챙겨 드시는 루틴이 아주 꼼꼼하시네요! 이미 잘 관리하고 계신 만큼, 제안드리는 '바이탈케어 데일리 멀티비타민'은 **'복잡한 루틴을 효율적으로 정리하고 싶은 분'**께 최적화되어 있습니다.\n\n이 제품은 비타민 B군 고함량으로 피로 회복을 돕고, 면역을 위한 아연·비타민 D, 그리고 눈 건강을 위한 루테인까지 '올인원'으로 배합되어 있습니다. 기존에 드시는 루틴과 비교하자면, **[종합비타민 + 루테인]의 기능을 1정으로 통합**할 수 있어, 오메가3만 따로 챙기시면 되는 구조로 루틴을 대폭 간소화할 수 있습니다. \n\n특히 60정(2개월분)에 29,900원으로 하루 약 500원꼴이라 경제적인 면에서도 효율적입니다. 매번 여러 통을 열고 닫는 번거로움에서 해방되는 것이 가장 큰 실익인데, 혹시 현재 드시는 제품들의 함량 수치를 알려주시면 제가 지금 제안드리는 제품과 상세히 비교해 드릴까요? 굳이 바꾸지 않으셔도 되니, 비교만 해보셔도 좋습니다."
    },
    {
      "role": "persona",
      "content": "말씀하신 대로라면 현재 제가 먹는 종합비타민의 비타민 B군 함량과 루테인 단일제 함량을 확인해볼 필요가 있겠네요. 제가 지금 먹는 건 종합비타민(비타민 B군 50mg 함유)과 루테인 20mg 단일제인데, 이 '바이탈케어' 제품의 비타민 B군과 루테인 함량은 각각 몇 mg씩 들어있나요?\n\n단순히 두 알을 하나로 줄이는 게 목적이라, 만약 이 제품으로 합쳤을 때 기존에 먹던 함량보다 수치가 눈에 띄게 낮아진다면 굳이 바꿀 이유가 없거든요. 특히 루테인은 제가 눈 피로 때문에 20mg을 고집하고 있는데, 이 부분까지 커버가 되는지 정확한 수치로 확인 부탁드립니다. 비교표를 만들어주시면 제가 지금 먹는 제품과 바로 대조해보고 실익을 따져보겠습니다."
    },
    {
      "role": "agent",
      "content": "꼼꼼하게 수치를 비교하시는 모습이 정말 현명하시네요! 건강을 위해 성분을 따지는 것은 당연한 권리입니다.\n\n바이탈케어 데일리 멀티비타민의 핵심 함량은 다음과 같습니다. \n\n*   **비타민 B군:** 활성형을 포함하여 총 100mg (고함량 설계로 에너지 대사에 집중)\n*   **루테인:** 20mg (식약처 권장 일일 최대 섭취량 충족)\n\n고객님께서 현재 드시는 루테인 20mg과 동일한 함량이며, 비타민 B군은 오히려 더 높은 수치로 설계되어 있습니다. 아래는 비교표입니다.\n\n| 구분 | 현재 루틴 (종합비타민+루테인) | 바이탈케어 데일리 |\n| :--- | :--- | :--- |\n| **비타민 B군** | 50mg | **100mg** |\n| **루테인** | 20mg | **20mg** |\n| **편의성** | 2회 복용 / 2개 제품 | **1회 복용 / 1개 제품** |\n\n보시다시피 함량은 유지하거나 상회하면서도, 아침 식후 딱 1정으로 루틴이 절반으로 줄어드는 실익이 있습니다. 루테인 20mg을 고집하시는 고객님의 기준을 충분히 만족시킬 수 있을 것 같은데, 어떻게 생각하시나요? 궁금하신 점이 더 있다면 말씀해 주세요."
    },
    {
      "role": "persona",
      "content": "함량 수치 확인했습니다. 비타민 B군이 50mg에서 100mg으로 늘어나는 건 에너지 대사 측면에서 확실히 체감이 다를 것 같네요. 루테인도 20mg을 그대로 유지하니 함량 면에서는 빠지는 게 없군요.\n\n다만, 한 가지 더 체크할 게 있습니다. 제가 먹는 종합비타민에는 비타민 D가 1,000IU 포함되어 있는데, 이 제품은 비타민 D 함량이 어떻게 되나요? 그리고 기존 종합비타민에 들어있던 미네랄(특히 마그네슘이나 셀레늄 등) 종류와 함량도 함께 표기된 상세 자료가 있으면 공유 부탁드립니다. \n\n함량 손실 없이 루틴을 단순화할 수 있다면 긍정적으로 검토해볼 생각입니다. 비타민 D와 미네랄 구성까지 확인하고 나서, 제가 현재 먹는 제품들과의 최종 비용 비교를 마무리하면 되겠네요. 자료 부탁드립니다."
    }
  ],
  "ended_by": "turn_limit"
}