{
  "session_id": "conv-strategy-ROI_LOGICAL_CONTRAST-P003",
  "strategy_id": "strategy-ROI_LOGICAL_CONTRAST",
  "persona_id": "P003",
  "turns": [
    {
      "role": "agent",
      "content": "오후 3시만 되면 습관처럼 4,500원짜리 커피부터 찾고 계시진 않나요? 하루 500원이면 해결되는 '바이탈케어 데일리 멀티비타민'으로, 피로를 잠시 미루는 카페인의 '에너지 가불' 대신 몸속에서 직접 에너지를 생성하는 근본적인 습관을 시작해보시는 건 어떨까요?\n\n커피 한 잔(4,500원)을 한 달간 매일 마시면 약 135,000원이지만, 이 제품은 한 달에 15,000원꼴이라 비용 부담은 1/9 수준으로 줄어듭니다. 특히 비타민 B군은 카페인처럼 신경을 자극하는 것이 아니라, 탄수화물과 단백질을 실제 에너지(ATP)로 전환하는 대사 과정을 돕기 때문에 훨씬 건강한 활력을 느끼실 수 있습니다. 혹시 평소 피로감 때문에 커피를 자주 찾으시는 편인가요?"
    },
    {
      "role": "persona",
      "content": "커피는 사실 피로해서 마시기도 하지만, 아침에 애들 챙기고 출근해서 정신 좀 차리려고 습관적으로 마시는 게 커요. 하루 500원이면 비용은 확실히 매력적이네요.\n\n그런데 궁금한 건, 제가 지금 비타민 따로, 유산균 따로 챙겨 먹느라 아침마다 정신이 없거든요. 이거 하나로 기존에 먹던 것들을 얼마나 대체할 수 있는 건가요? 아니면 이것도 결국 추가로 하나 더 챙겨야 하는 건지, 아침에 물 한 잔이랑 이거 딱 하나만 먹으면 끝나는 구조인지 확실히 알고 싶어요. 성분 나열보다는 이게 제 아침 루틴을 얼마나 단순하게 만들어줄지가 중요해서요."
    },
    {
      "role": "agent",
      "content": "바쁜 아침 시간에 영양제까지 챙기느라 정신없으셨죠? 솔직히 말씀드리면, '바이탈케어 데일리 멀티비타민'은 유산균을 완전히 대체하는 제품은 아닙니다. 다만, 이 제품은 비타민 B군과 D, 아연, 그리고 현대인에게 필수인 루테인까지 한 알에 담아 **'종합 에너지·기초 영양'**을 담당합니다.\n\n따라서 기존에 드시던 유산균은 그대로 유지하시되, 그동안 흩어져 있던 비타민제나 영양제들을 이 한 알로 통합하신다면 아침 루틴이 훨씬 간결해질 겁니다. 물 한 잔과 함께 이 한 알만 더하시면, 여러 통을 꺼낼 필요 없이 '유산균 + 멀티비타민'으로 루틴을 즉시 단순화할 수 있죠. \n\n혹시 지금 드시는 제품 중에 아연이나 비타민D 함량이 높은 제품이 포함되어 있을까요? 성분 중복을 체크해드리면, 더 마음 편히 루틴을 정리하실 수 있도록 도와드릴 수 있습니다."
    },
    {
      "role": "persona",
      "content": "아, 유산균은 따로 둬야 하는군요. 솔직히 비타민제나 엽산, 아연 이런 거 다 따로 챙기다가 결국 귀찮아서 유통기한 지나 버리는 게 반이라, 통합할 수 있다는 점은 괜찮네요. \n\n지금 제가 먹는 것들 중에 비타민D랑 아연이 포함된 게 있긴 한데, 이게 용량이 충분한 건지 애매해서 그냥 따로 먹고 있었거든요. 만약 이 '바이탈케어'로 바꾸면 기존에 먹던 비타민제랑 아연제는 아예 안 먹어도 되는 수준인가요? \n\n아침 전쟁 치르면서 영양제 통 3~4개씩 여는 게 제일 스트레스거든요. 유산균이랑 이거 딱 두 가지만 챙기면 된다면 루틴은 확실히 줄어들겠네요. 이거 한 알에 들어있는 비타민D나 아연 함량이 어느 정도인지, 제가 지금 먹는 것들이랑 비교해서 딱 정리해 주실 수 있나요? 그게 확인되면 바로 바꿀 의향 있어요."
    },
    {
      "role": "agent",
      "content": "정확히 보셨습니다. 아침마다 영양제 통 3~4개를 여는 스트레스를 줄이는 게 이번 제안의 핵심입니다. '바이탈케어 데일리 멀티비타민'에는 **아연 8.5mg(일일 권장량 100%)과 비타민D가 충분량** 포함되어 있어, 기존에 드시던 단일 비타민제나 아연 보충제는 이 제품 하나로 완전히 대체 가능합니다.\n\n성분 측면에서 정리해 드릴게요. \n1. **아연(8.5mg):** 성인 상한 섭취량(35mg) 내에서 안전하게 설계되었습니다. 기존에 드시던 아연 보충제는 중단하시고 이 제품으로 통합하시면 됩니다.\n2. **비타민D:** 충분한 함량이 포함되어 있어 별도의 단일 비타민D 제제는 정리하셔도 좋습니다.\n\n다만, 앞서 말씀드린 대로 **아연의 경우** 드시고 계신 다른 영양제(예: 종합 영양제나 미네랄제) 뒷면의 성분표를 한번 확인해 보세요. 혹시나 다른 영양제에도 아연이 포함되어 있다면, 그 총합이 35mg을 넘지 않는지만 체크하시면 됩니다. \n\n유산균과 이 제품, 딱 두 가지만 챙기는 루틴으로 바꾸신다면 아침이 훨씬 가벼워지실 겁니다. 혹시 지금 드시는 제품들 중 아연 함량이 따로 표기된 것이 있으실까요? 그 부분만 확인되면 바로 결정하셔도 좋을 것 같습니다."
    },
    {
      "role": "persona",
      "content": "지금 먹는 아연 보충제랑 비타민D 단일제 성분표를 방금 확인해 봤는데, 다 합쳐도 여기 함량이면 충분히 커버가 되겠네요. 결국 제가 챙기던 것들이 흩어져 있어서 더 복잡했던 거였네요.\n\n아침에 애들 챙기느라 정신없을 때 통 3~4개씩 꺼내서 뚜껑 돌려 여는 게 은근히 사람 진 빠지게 하거든요. 유산균이랑 이거 딱 두 가지만 식탁 위에 올려두면 되겠어요. 남은 영양제들 유통기한 신경 쓰면서 억지로 챙겨 먹느라 스트레스받지 말고, 그냥 바로 이걸로 루틴 정리하는 게 낫겠네요. 이거 바로 주문하면 언제부터 받을 수 있죠? 배송받고 나서 바로 기존에 먹던 것들은 정리해버려야겠어요."
    }
  ],
  "ended_by": "turn_limit"
}