{
  "session_id": "conv-strategy-roi-P001",
  "strategy_id": "strategy-roi-proof",
  "persona_id": "P001",
  "turns": [
    {
      "role": "agent",
      "content": "안녕하세���! 혹시 매일 영양제 드시나요? 요즘 직장인분들 사이에서 하루 500원으로 건강관리 시작하시는 분들이 많아서 소개해드리려고요."
    },
    {
      "role": "persona",
      "content": "아... 영양제요? 솔직히 먹어봤는데 효과를 잘 모르겠더라고요. 그리고 500원이라고 해도 매달이면 꽤 되잖아요."
    },
    {
      "role": "agent",
      "content": "맞아요, 그 고민 많이 하시더라고요. 바이탈케어는 60정에 29,900원이에요. 하루 500원인데, 편의점 커피 한 잔보다 싸거든요. 그리고 비타민B 고함량이라 피로감 차이를 2주 안에 느끼시는 분이 많아요."
    },
    {
      "role": "persona",
      "content": "2주면 좀 빠른데? 진짜 그 정도로 차이가 나요?"
    },
    {
      "role": "agent",
      "content": "개인차는 있지만, 비타민B군이 에너지 대사에 직접 관여하거든요. 그리고 30일 환불 보장이 있어서, 2주 드셔보시고 차이가 없으면 환불하셔도 돼요. 리스크가 없는 거죠."
    },
    {
      "role": "persona",
      "content": "환불 된다고요? 그건 좀 괜찮네요. 한 번 생각해볼게요."
    }
  ],
  "ended_by": "turn_limit"
}