{
  "session_id": "conv-strategy-ROI_LOGICAL_CONTRAST-P009",
  "strategy_id": "strategy-ROI_LOGICAL_CONTRAST",
  "persona_id": "P009",
  "turns": [
    {
      "role": "agent",
      "content": "오후 3시만 되면 습관처럼 4,500원짜리 커피부터 찾게 되시나요? 하루 500원으로 피로를 잠시 미루는 '에너지 가불' 방식 대신, 우리 몸 안에서 직접 에너지를 생성하는 '바이탈케어 데일리 멀티비타민'으로 건강한 습관을 시작해보세요.\n\n커피는 카페인으로 아데노신 수용체를 차단해 피로를 잠시 잊게 할 뿐이지만, 저희 비타민 B군(B1, B2 등)은 체내 탄수화물과 단백질을 실제 에너지원인 ATP로 전환하는 근본적인 대사 과정을 돕습니다. 월 기준으로 커피값이 약 135,000원이라면, 이 제품은 단 15,000원 수준으로 1/9의 비용으로 훨씬 효율적인 관리가 가능합니다. 혹시 평소 피로감 때문에 커피를 자주 찾으시는 편인가요?"
    },
    {
      "role": "persona",
      "content": "커피를 마시는 이유는 단순히 피로 때문만은 아니고 업무 집중을 위한 루틴의 일환이라, 이걸 단순히 비타민으로 대체한다는 접근은 좀 비약인 것 같습니다. \n\n이미 저는 아침에 종합비타민을 챙기고 있고, 오후에는 오메가3와 유산균을 먹고 있어요. 제가 궁금한 건 '바이탈케어'의 비타민 B군 함량과 제 기존 루틴과의 중복 여부입니다. 특히 현재 먹는 종합비타민에도 비타민 B군이 포함되어 있는데, 이 제품으로 바꿨을 때 굳이 추가로 챙기지 않아도 될 만큼 함량이 충분한지, 혹은 기존 제품과 병행했을 때 과다 섭취 위험은 없는지 성분표를 기준으로 설명해주시겠습니까? 구체적인 수치를 알고 싶습니다."
    },
    {
      "role": "agent",
      "content": "합리적인 고민이십니다. 단순히 커피를 대체하는 것이 아니라, 기존 루틴의 효율성을 점검하시는 과정으로 이해하겠습니다.\n\n먼저 저희 '바이탈케어'는 비타민 B군을 일일 권장량 대비 300% 이상 고함량으로 설계하여, 에너지 대사 효율을 극대화하는 데 집중했습니다. 이미 종합비타민을 드시고 계시다면, 성분표를 비교해 보시는 것이 가장 정확합니다. 일반적으로 비타민 B군은 수용성이라 필요한 만큼 쓰이고 배출되기에 과잉 우려가 적으나, **아연**은 주의가 필요합니다. 본 제품에는 아연이 8.5mg(일일 권장량 100%) 포함되어 있는데, 성인 아연 상한 섭취량이 35mg이므로 기존 종합비타민과 합산하여 이 수치를 넘지 않는지 확인이 필요합니다.\n\n만약 기존 제품의 B군 함량이 충분하다면 굳이 중복 섭취하실 필요는 없습니다. 다만, 저희 제품은 B군 외에도 눈 건강을 위한 루테인과 면역을 위한 비타민D가 포함되어 있어, 여러 알을 챙겨야 하는 번거로움을 줄이는 '올인원' 대안으로 고려해 보실 수 있습니다. 현재 드시는 종합비타민의 아연 함량은 어느 정도인가요? 수치를 알려주시면 중복 여부를 명확히 판단해 드리겠습니다."
    },
    {
      "role": "persona",
      "content": "제가 먹는 종합비타민의 아연 함량은 12mg입니다. 말씀하신 제품과 합치면 20.5mg이니 상한선인 35mg은 넘지 않겠네요. 하지만 문제는 비타민 B군입니다. 지금 먹는 제품도 B군이 이미 100% 이상 들어있는데, 여기에 귀사의 제품(300% 이상)을 더하면 굳이 필요 이상의 고함량을 섭취하는 꼴이 됩니다.\n\n결국 '올인원'이라는 장점을 살리려면, 기존 종합비타민을 빼고 귀사의 제품으로 아예 갈아타야 한다는 계산이 나오는데요. 그렇게 했을 때 제 오후 루틴인 오메가3와 유산균을 제외하고, 아침에 먹던 종합비타민을 이 제품으로 대체하면 성분상으로 얻는 실익이 구체적으로 무엇인가요? 단순히 B군 함량이 높다는 것 말고, 기존 제품 대비 성분 구성이나 흡수율 면에서 제가 얻는 차별점이 무엇인지 비교표를 보여주시면 판단이 빠를 것 같습니다."
    },
    {
      "role": "agent",
      "content": "정확한 분석 감사합니다. 아연 합산 20.5mg은 상한치 35mg 이내로 안전한 범위입니다.\n\n기존 종합비타민을 저희 제품으로 교체했을 때의 차별점은 **'에너지 대사 최적화'**와 **'현대인 맞춤형 부원료'**의 유무입니다. 기존 제품이 영양소의 '결핍 방지'에 초점이 맞춰져 있다면, 저희 제품은 '에너지 생성 효율'을 극대화하는 데 설계의 무게를 두었습니다.\n\n| 구분 | 기존 종합비타민(일반) | 바이탈케어 데일리 |\n| :--- | :--- | :--- |\n| **비타민 B군** | 100% (권장량 충족) | **300% (고함량 대사 촉진)** |\n| **에너지 대사** | 유지 수준 | **ATP 전환 효율 극대화** |\n| **눈 건강(루테인)** | 미포함 | **포함 (디지털 기기 사용 대응)** |\n| **비용(1일)** | 제품별 상이 | **약 500원 (가성비 우수)** |\n\n**성분상 얻는 실익은 크게 두 가지입니다.**\n첫째, 비타민 B군 300% 설계는 단순 영양 보충을 넘어, 오후 시간대 피로가 누적되기 전 에너지 대사를 가속화합니다. 둘째, 루테인이 포함되어 있어 따로 눈 건강 영양제를 챙길 필요 없이 '에너지+눈+면역(아연/D)'을 한 알로 통합할 수 있다는 점입니다.\n\n오메가3와 유산균은 그대로 유지하시되, 아침 루틴을 이 제품으로 단일화하시면 영양제 가짓수는 줄이면서 에너지 대사 효율은 높이는 **'루틴 다이어트'**가 가능해집니다. 혹시 현재 드시는 종합비타민과 비교했을 때, 루테인이나 비타민D 함량도 체크해 보셨을까요? 성분표를 다시 한번 대조해보시면 효율적인 선택에 도움이 되실 겁니다."
    },
    {
      "role": "persona",
      "content": "제시해주신 비교표는 확인했습니다. 확실히 B군 함량과 루테인 포함 여부는 차이가 있네요. \n\n다만, 제가 우려하는 건 '루틴 다이어트'라는 명목으로 기존 종합비타민에 있던 다른 미네랄이나 미량 영양소들이 누락되지는 않는지입니다. 예를 들어, 기존 제품에는 비타민 A, C, E나 셀레늄, 마그네슘 같은 성분들이 포함되어 있는데, 귀사의 제품으로 갈아타면 이런 미량 영양소들은 아예 섭취가 중단되는 셈이거든요. \n\n에너지 대사 효율을 높이는 것도 좋지만, 종합비타민이라는 이름에 걸맞게 전반적인 영양 밸런스가 유지되는지가 궁금합니다. 귀사 제품의 전체 성분표를 봤을 때, 기존 종합비타민 대비 '포기해야 하는' 성분은 구체적으로 무엇이며, 그로 인해 제가 잃는 영양적 균형을 어떻게 보완할 수 있다고 보시는지 궁금합니다. 이 부분까지 명확해져야 고민을 끝낼 수 있을 것 같습니다."
    }
  ],
  "ended_by": "turn_limit"
}